"Name","Description","Homepage","Social networks accounts","E-mail","Contact page","Organisation Type","Physical address","Legal entity","Year of foundation","Language(s) of the platform","Phone","Keywords","Type of activity","The most important type of collaboration","Type of common resource resulting","User generated content license","Software platform license","Owner","Infrastructure provider","Other information","Scope"
"Hitchwiki","Global resource about hitchhiking written by hitchhikers. This is not about paid ride shares, this is about the real thing, traveling with no or almost no money.","http://hitchwiki.org/","http://facebook.org/Hitchwiki","contact@hitchwiki.org","http://hitchwiki.org/contact/","Grass Roots Organization Or Community Network","","not for profit organization","2006-01-01 00:00:00","Chinese, Dutch, English, French, German, Russian, Spanish","","hitchhiking, transport","FLOSS communities, Community networks, Collaborative writing, Collaborative video, audio, images, Collaborative mapping, Free software social networks and platforms","Exchange","Resource","Creative Commons: Attribution-ShareAlike (CC BY-SA)","GNU General Public License V2","editors","","","International"
"WikiEducator","WikiEducator is a community project working collaboratively with the Free Culture Movement towards a free version of the education curriculum by 2015. Driven by the learning for development agenda WikiEducator focuses on: 
- developing free content for use in schools, polytechnics, universities, vocational education institutions and informal education settings;
- building capacity in the use of Mediawiki and related free software technologies for mass-collaboration in the authoring of free content;
- facilitating the establishment of community networks and collaboration with existing free content initiatives in education;
- fostering new technologies that will widen access, improve quality and reduce the cost associated with providing education, primarily through the use of free content.
 ","http://wikieducator.org/","","","http://wikieducator.org/WikiEducator:Discussion","Grass Roots Organization Or Community Network","","other","2006-01-01 00:00:00","English","","","Community networks, Collaborative research, Open education","Collage","Resource, Service, Design, Methodology","Creative Commons: Attribution-ShareAlike (CC BY-SA)","GNU General Public License V2","","Erik Möller","","International"
"Howtopedia ","Howtopedias objective is to become the reference for people looking for resources for empowerment. The platform promotes simple technologies in all areas of daily life. howtopedia focuses on a bottom-up strategy. It collects and disseminates self-help resources and know-how in order to facilitate the local self-organization worldwide in four languages: English, Español, Français, Português.","http://en.howtopedia.org","","info@howtopedia.org","http://en.howtopedia.org/wiki/Howtopedia_-_english:About","Grass Roots Organization Or Community Network","","not for profit organization","2010-01-01 00:00:00","English, French, German, Portuguese, Spanish","00 41 44 55 89 809","practical knowledge, simple technologies","Community networks, Open technology, Open education","Collage","Resource","GNU Free Documentation License","GNU General Public License V2","Howtopedia","Howtopedia","","International"
"Energypedia","Global community that co-creates practical knowledge on production and design of renewable energies and sustainable energy sources. The vision of the energypedia knowledge commons platform is “a world of free knowledge exchange and mutual learning on renewable energies in which everyone has access to sustainable energy sources.” On energypedia.info anyone can create and revise articles on renewable energy technologies, approaches and projects as well as energy efficiency.","https://energypedia.info/","http://www.linkedin.com/company/energypedia?trk=company_name","info@energypedia.info","https://energypedia.info/wiki/Feedback","Social Enterprise Charity Or Foundation","energypedia UGenergypedia UG00000 EschbornGermany","not for profit organization","2012-01-01 00:00:00","English","0049 6196 2029722","Biogas, Biomass, Solar Power, Energy, EnDev","Open technology, Open design, Collaborative research, Open education, Others","Exchange","Resource, Service, Methodology","Creative Commons: Attribution (CC BY)","GNU Lesser General Public License","energypedia","energypedia UG","Popular themes on Energypedia are  ... 

Biogas, Biomass, Solar Power, Energy, EnDev, Energy Use, Ethiopia, Financing and Funding, Fuel Price Data , Fuel Price Database, Fuel Price Factsheet, GIZ, HERA, Grid, Hydro, Hydropower sites, Impacts, Improved Cooking, Indonesia, Kenya, Mobility, PicoPV, PicoPV Company, PicoPV System, Productive Use, Project Resource Center, Rural Electrification, Solar  TEA, ESI, households, Uganda, Wind","International"
"Soinumapa"," SOINUMAPA.NET is a Basque country Sound Map open archive project. Based on phonography or the art of recording environmental sounds, its aim is to show, share and exchange field recordings made in the Basque Country.","http://www.soinumapa.net/","","audiolab.arteleku@gmail.com","http://www.soinumapa.net/ongi-etorriwelcomebienvenidoa/harremanetarakocontact...","Academia And Research","ARTELEKU – audiolab Kristobaldegi 14,Loiola Auzoa20014 Donostia – San SebastiánSpain","public institution","2004-01-01 00:00:00","Basque, English, Spanish","34 943 45 36 62","sounds, map, sound map, creative commons, Basque Country","Collaborative archive, Collaborative mapping","Album","Resource","Creative Commons: Attribution (CC BY)","GNU General Public License V2","","Centro de Arte Contemporáneo Arteleku","","Local"
"SocialCompare","SocialCompare.com is an innovative sharing community that allows users to consult, create, modify and share comparisons in any domain","http://socialcompare.com","https://twitter.com/socialcompare, http://facebook.com/socialcompare","contact@socialcompare.com","http://socialcompare.com/en/contact","","SocialCompare SARL 294RD3783440 MontaurouxFrance","for profit organization","2014-01-01 00:00:00","English, French","","crowdsourcing, compare, tables","Collaborative writing","Collage","Resource","Creative Commons: Attribution-ShareAlike (CC BY-SA)","Private software","","SARL SocialCompare","","International"
"Radio ELA","Radio ELA is a community radio from Madrid. ELA stands for ""Emisora Libre y Autogestionada"" which can be translated as ""Free and Self-managed Radio Station"". Its community consists of different kinds of programs (musical, political, humor, etc.). New programs are encouraged to join the project.

Radio ELA ony uses free software. ","http://www.radioela.org","https://twitter.com/radioela, https://es-es.facebook.com/RadioELA","info@radioela.org","","Grass Roots Organization Or Community Network","MadridSpain","other","2008-01-01 00:00:00","Spanish","","community radio, radio, free culture, madrid, autonomous","Urban commons","Album","Resource","No license","GNU General Public License V3","","Radio ELA","","Local"
"Guerrilla Translation","Inspired by a love of sharing, Guerilla Translation facilitates access to valuable ideas in uncertain times.

Guerrilla Translation is a collaborative hub for authors and translators to network and share stimulating ideas internationally. Our aim is to model a cooperative form of global idea-sharing, by enabling a platform and method for opening dialogues.

Although GT offers the same range of services as a traditional translation agency, it is anything but. Material is chosen for translation according to its social and environmental value, not its profit potential. We are a P2P service, in which our authors, rather than clients, are partners in an ongoing creative process. GT also acts as a curator of written and visual content through its blog, social media and video channels. Our founding principles can be read here: http://guerrillatranslation.com/the-guerrilla-translation-manifesto/","http://guerrillatranslation.com/","http://guerrillatranslation.com, https://twitter.com/GuerrillaTrans, https://www.facebook.com/pages/Guerrilla-Translation/151238068385765, https://plus.google.com/102403832437462161937/about, http://www.youtube.com/user/GuerrillaTranslation/videos, http://www.scoop.it/u/guerrilla-translation","info@guerrillatranslation.com","http://guerrillatranslation.com/contact/","Grass Roots Organization Or Community Network","Spain","other","2013-01-01 00:00:00","English, Spanish","","commons, activism, environmentalism, translation, subtitling","Community networks, Collaborative writing, Collaborative video, audio, images, Citizen media, Collaborative research, Open data commons, Others","Exchange","Resource, Service, Methodology, Brand, Others","Peer Production License Option","Other licenses","Guerrilla Translation/Source authors","","","International"
"Poplus ","Poplus is an international community of activists, citizens and developers.They  create standardised, internationalised, interoperable, open-source Components, to make it easier to build websites that empower citizens, no matter where they are based.
You have a vision that would make your country's democracy more accessible for everyone. You’ve seen sites like TheyWorkForYou.com or VotaInteligente.cl and would like to build a similar site that monitors your Parliament. It would provide information about all the representatives, and publish everything they say or vote on. Thanks to your website, people would be far better informed about what goes on in Parliament, and better able to make fact-based decisions.
","http://poplus.org/","https://twitter.com/poplusproject","","http://www.ciudadanointeligente.org/contacto/","Grass Roots Organization Or Community Network","United Kingdom","not for profit organization","2010-01-01 00:00:00","English, Spanish","","advocacy service, accountability, digital democracy","Community networks","Collage","Resource, Service","Creative Commons: Attribution (CC BY)","Other licenses","mySociety  and Ciudadano Inteligente","GitHub","",""
"Sayit","It’s an open source tool for making transcripts really easy to read, search and share on the modern internet. Transcripts are a kind of oil that greases the wheels of well-functioning societies. They let people discover when powerful people have made pronouncements that affect less powerful people. We believe that by making transcripts function better, more people will end up learning about decisions and opinions that affect their lives.
The design is mobile responsive to make reading and navigation pleasant across devices, large and small
Search within an entire database of speeches, for example a whole trial, or everything said by an elected assembly – better than opening hundreds of PDFs and searching manually.
Search within one person’s speeches, even if they only speak occasionally; and each speech is linked to a person, making it easy to see everything someone has said.
Easily share links to a single session (for example at a trial), or even a single speech within a session.
Make your transcripts more likely to show up clearly in search engines.
There’s an API for people who want to do more advanced text processing.","http://sayit.mysociety.org/","https://twitter.com/sayitpoplus, https://www.facebook.com/sayitpoplus, https://github.com/mysociety/sayit","sayit@mysociety.org","","Grass Roots Organization Or Community Network","483 Green Lanes London N13 4BS UKLondonUnited KingdomN13 4BSUnited Kingdom","not for profit organization","2012-01-01 00:00:00","English","","advocacy service, Citizens, accountability","Community networks","Building collective process","Service, Others","Public Domain","AGPL license","mySociety","mySociety","The data standard we are using is a subset of Akoma Ntoso – a standard developed specifically for use in parliaments and assemblies.",""
"CitizenSpeak","CitizenSpeak was a free email advocacy service that enabled grassroots organizations and individual activists to launch MoveOn-like email campaigns and track participation. CitizenSpeak campaigns were easy to set-up and only require a web-browser and basic web-surfing skills to use.
With CitizenSpeak users could:
Empower members to easily lobby decision-makers.
Increased awareness by sending decision-makers individually addressed emails.
Extended reach with the Internet’s networking ability.
Learned more about supporters with downloadable reports that detail participant contact info and personal statements.
Growed membership and fundraise with customizable ‘Thank You’ pages that invited participants to donate or join.
Increased website traffic by promoting a web address on a customizable ","http://citizenspeak.org/","https://www.facebook.com/pages/CitizenSpeak/148295868517028?id=148295868517028&sk=info","","http://citizenspeak.org/contact","Grass Roots Organization Or Community Network","United States","not for profit organization","2002-01-01 00:00:00","English","","collective action, grass roots organization, advocacy service","Community networks","Building collective process","Service","Creative Commons: Attribution (CC BY)","Other licenses","Citizen Speak","","It is make on drupal ",""
"OpenHatch","OpenHatch runs education events and maintains free, web-based learning tools, to help people get involved in collaborative software development; and we work with computer programming meetup groups to help them run more newcomer-friendly and gender-diverse events. These meetup groups are educational groups that meet free of cost to educate the public on computer software programming topics.
If you have: OpenHatch is a non-profit organization with the goals of lowering the barriers to entry into the open source community and increasing diversity. We achieve these goals through a number of initiatives.","http://openhatch.org/","https://openhatch.org/wiki/OpenHatch_wiki:About, https://twitter.com/openhatch, http://identi.ca/openhatch, https://github.com/openhatch/oh-mainline","hello@openhatch.org","http://lists.openhatch.org/mailman/listinfo/osctc-planning","Grass Roots Organization Or Community Network","San Francisco, CAUnited States","not for profit organization","2012-01-01 00:00:00","English","","free software, open source, software tutorial","FLOSS communities, Others","Exchange","Service","Creative Commons: Attribution (CC BY)","Open Source License","Open Hatch ","Open Hatch","",""
"Crowdmap","Crowdmap is a tool that allows you to crowdsource information and see it on a map and timeline. It enables anyone to run their own crowdsourcing site without having to know the intricacies of running their own server. It's free and it's yours to use.
Mission
Enable anyone too...
1. Collect information from cell phones, news and the web.
2. Aggregate that information into a single platform.
3. Visualize it on a map and timeline.
Company Overview
Ordinary people have a voice, and interesting things happen when you aggregate those voices and visualize the results. Surprising information and insights can be found.

Crowdmap is a tool that allows you to crowdsource information and see it on a map and timeline. It is the Ushahidi platform, built by the team who created Ushahidi as a way for anyone to run their own crowdsourcing site without having to know the intricacies of running their own server. It's free and it's yours to use.","https://crowdmap.com/welcome","https://twitter.com/Crowdmap, https://www.facebook.com/crowdmap","","https://crowdmap.com/mhi/contact","Grass Roots Organization Or Community Network","United States","not for profit organization","2010-01-01 00:00:00","Catalan, English, French, German, Portuguese, Spanish","","Collective mapping, map visualization","Community networks, Collaborative mapping","Collage","Resource, Service","Other","Private software","Ushahidi","Ushahidi","",""
"CrowdtiltOpen ","Crowdfunding solution for brands, businesses, and organizations. Self-hosting a campaign allows you to use advanced tools to collect more funds, build your brand, and capture long-term value and traffic. CrowdtiltOpen brings that power to everyone, even non-engineers.

 CrowdtiltOpen is an end-to-end solution that makes it easy to launch your own professional white-labeled crowdfunding, presale, or donation page. CrowdtiltOpen will host your page, handle payment processing, and leave you to focus on what your goal: raising funds. You'll control the look and feel, plug in third-party services you love, and manage your backers—all without writing a line of code.

Unlike most third-party platforms, there are no arbitrary guidelines here. CrowdtiltOpen can be used for collecting pre-orders, raising funds for charity, a group experience, or anything else you can imagine.

You can launch a campaign on your own domain (say, campaign.soylent.me), run multiple campaigns at once, and change your page whenever you want. And with first-ever features like recurring-billing based rewards and Bitcoin integration, your imagination's the only limit. ","https://open.crowdtilt.com/","https://www.facebook.com/crowdtilt, https://twitter.com/Crowdtilt, https://github.com/crowdtilt/crowdtiltopen","open@crowdtilt.com","","Social Enterprise Charity Or Foundation","San FranciscoUnited States","not for profit organization","2012-01-01 00:00:00","English","+1 888-921-8458","crowdfunding, collective action, collected money","Peer funding","Building collective process","Service","GNU General Public License","MIT License","Crowdtilt ","","",""
"Alaska Permanent Fund","The Alaska Permanent Fund is a constitutionally established permanent fund managed by a state-owned corporation, the Alaska Permanent Fund Corporation (APFC). It is a stakeholder trust model of management for large-scale commons that distributes revenues from a shared asset (such as oil on Alaskan land) to every household in the state (roughly $1,000 to $2,000 each year). 
The fund was established in Alaska in 1976, after oil from Alaska began flowing to market through the Trans-Alaska Pipeline System, to invest at least 25% of the oil money into a dedicated fund for current and future generations of Alaskans. The Fund grew from an initial investment of $734,000 in 1977 to approximately $42.1 billion as of August 31, 2012.","http://www.apfc.org/home/Content/home/index.cfm","","","","Social Enterprise Charity Or Foundation","","for profit organization","1976-01-01 00:00:00","English","","","Others","Other","Resource, Others","Other","Other licenses","","","",""
"Remix The Commons","Remix The Commons is an intercultural space for sharing and co-creating multimedia documents about the commons.  It aims at documenting and illustrating key ideas and practices of the commons movement, including through the creative process of the project itself. The project is hosted by an intercultural collective of people and organizations convinced that the curation, exchange and remixing of diverse narratives, definitions and images of the commons are a dynamic and participatory way of appropriating and disseminating the concept of the commons.

Remix The Commons was initiated in 2010 by Alain Ambrosi with the organizations of Communautique and VECAM, in Québec and France. Forum des Alternatives Maroc « FMAS » in Maroco, KËR THIOSSANE and the “Laboratoire de recherches sur les transformations économiques et sociales” (LARTES) of IFAN, in Senegal have joined the circle in 2011. Remix The Commons is constituted and functions as commons. The collective charter defines its values, mission and governance rules, all of which are open to discussion. In 2013, the charter Remix the Commons has been drafted to be adopted by individuals and organizations wishing to be part of the collective Remix the Commons in charge of project governance.","http://www.remixthecommons.org/","http://www.youtube.com/user/Remixthecommons/videos?flow=grid&sort=p&view=0, http://vimeo.com/user5449180","remixthecommons@gmail.com","http://www.remixthecommons.org/en/contact/","Social Enterprise Charity Or Foundation","Canada","not for profit organization","2010-01-01 00:00:00","English, French","","","Collaborative video, audio, images, Collaborative archive, Citizen media, Collaborative research, Citizen science, Open data commons","Collage","Resource, Service, Methodology, Brand","Creative Commons: Attribution-ShareAlike (CC BY-SA)","Creative commons: BY-SA 3.0","Collective Remix The Commons (a coalition of organizations)","","",""
"Freesound","Freesound aims to create a huge collaborative database of audio snippets, samples, recordings, bleeps, ... released under Creative Commons licenses.","http://www.freesound.org","","support@freesound.org","http://www.freesound.org/contact/","Academia And Research","Plaça de la Mercè, 10-12BarcelonaSpain","public institution","2005-01-01 00:00:00","English","","creative commons, sounds, free culture","Collaborative archive","Album","Resource","Creative Commons: Attribution (CC BY)","AGPL license"," Music Technology Group at Universitat Pompeu Fabra","Universitat Pompeu Fabra","",""
"Jamendo","Jamendo is a music website and an open community of music authors. It bills itself as ""the world's largest digital service for free music"". Since the beginning in 2005, Jamendo's music has been licensed under Creative Commons licenses. ","http://www.jamendo.com","https://www.facebook.com/JAMENDO, https://twitter.com/Jamendo, https://plus.google.com/+jamendo/posts, http://www.youtube.com/user/JamendoTV","contact@jamendo.com","http://www.jamendo.com/en/contact","Business","76, Avenue de la LibertéL-1930 LuxembourgLuxembourg","for profit organization","2005-01-01 00:00:00","English, French, German, Italian, Polish, Spanish","","music, creative commons, audio, artists, repository","Collaborative video, audio, images","Album","Resource, Service","Other","Private software","Multiple owners of the contents","Jamendo SA","",""
"Generatech","Generatech is a platform for the empowerement of gender in the audiovisual technoculture. It hosts collaborative spaces for communities related to critical views on gender, feminism, bodies, sexuality and related issues, while promoting free software and free culture.","http://generatech.org","","","http://generatech.org/contact","Academia And Research","","other","2007-01-01 00:00:00","Catalan, English, Spanish","","gender, feminism, free culture, transmedia  service, video library","Collaborative video, audio, images, Free software social networks and platforms","Album","Resource, Service","GNU Free Documentation License","GNU General Public License V2","Multiple owners: Generatech_Core, Fractalidades en Investigación Crítica del Departamento de Psicología Social de la UAB, Ideadestroyingmuros, nomepisesofreghao, ekka & hangar","Research group (Fractalidades en Investigación Crítica) of Social Psychology Dept of the Universitat Autonoma de Barcelona","",""
"Bajo el Asfalto está la Huerta (BAH)","The Bajo el Asfalto está la Huerta (BAH) is an ecological farming initiative focused on sustainable agriculture outside of market dynamics, implementing an alternative model of agricultural production, distribution and consumption. This model is based on self-organisation, assembly-based decision-making and horizontal non-hierarchical relationships. This makes it possible to establish direct links between the producer and the consumer, and implies the direct participation in the construction and development of the project of both the workers on the land and the members of the consumption groups in the different neighbourhoods of Madrid.","http://bah.ourproject.org/","","bah@ourproject.org ","http://bah.ourproject.org/sobre-el-bah/article/contacta-con-el-bah","Grass Roots Organization Or Community Network","MadridSpain","not for profit organization","1999-01-01 00:00:00","Spanish","","sustainability, ecology, farming, agriculture","Urban commons, Others","Physical resource","Resource","No license","GNU General Public License V2","","","",""
"CSA La Tabacalera de Lavapiés","CSA Tabacalera is a self-managed social center in the Lavapiés neighbourhood in Madrid (Spain) with 9,200 square metres. The building is an old factory of tobacco owned by the Spanish Ministry of Culture and considered public cultural heritage. ","http://latabacalera.net/","https://twitter.com/latabacalera, https://es-es.facebook.com/pages/CSA-La-Tabacalera-de-Lavapi%C3%A9s/131688400207517","comunicacion@latabacalera.net","http://latabacalera.net/participa/","Grass Roots Organization Or Community Network","Calle Embajadores 53, 28012, Madrid28012 MadridSpain","not for profit organization","2010-01-01 00:00:00","Spanish","","free culture, social centre, social center, collaborative space, lavapiés","Urban commons, Hacklabs / Collaborative spaces, Others","Space","Resource","Creative Commons: Attribution-ShareAlike (CC BY-SA)","GNU General Public License V2","","","",""
