"Open Structures (OS)","The OS (OpenStructures) project explores the possibility of a modular construction model where everyone designs for everyone on the basis of one shared geometrical grid. It initiates a kind of collaborative Meccano to which everybody can contribute parts, components and structures.","http://openstructures.net","","info@openstructures.net","","","","","2009-01-01 00:00:00","English","","","Open technology, Open design","Physical resource","Resource, Design","Other","Other licenses","","Intrastructures http://intrastructures.net","",""
"n-1","Free self-managed social networks: N-1 is one of the nodes of Lorea.org, a project that aims to create a distributed and federated organization of autonomous entities. We are developing social software for activist networks, we desire visibility but not to give up our privacy and security","https://n-1.cc","","federation@lorea.org","","Grass Roots Organization Or Community Network","United Kingdom","not for profit organization","2012-01-01 00:00:00","English, Spanish","","","FLOSS communities, Collaborative writing, Free software social networks and platforms","Collage","Resource, Service","GNU General Public License","AGPL license","","Lorea.org, Elgg","",""
"Kune","Kune is a free/open source distributed social network focused on collaboration rather than just on communication. That is, it focuses on online real-time collaborative editing, decentralized social networking and web publishing, while focusing on workgroups rather than just on individuals. It aims to allow for the creation of online spaces for collaborative work where organizations and individuals can build projects online, coordinate common agendas, set up virtual meetings, publish on the web, and join organizations with similar interests. It has a special focus on Free Culture and social movements needs","http://kune.ourproject.org","https://twitter.com/kuneproject, https://identi.ca/kuneproject","kune@ourproject.org","http://kune.ourproject.org/contact/","Grass Roots Organization Or Community Network","","not for profit organization","2007-01-01 00:00:00","Arabic, Basque, Catalan, Chinese, English, French, German, Greek, Hungarian, Italian, Polish, Portuguese, Romanian, Russian, Slovenian, Spanish, Turkish","","social network, collaborative software, federated network, real-time, free culture","FLOSS communities, Collaborative writing, Free software social networks and platforms","Album","Resource, Service, Methodology","Other","AGPL license","Comunes Collective","","",""
"Ourproject","Ourproject.org is a web-based collaborative free content repository. It acts as a central location for offering web space and tools for projects of any topic, focusing on free knowledge. It aims to extend the ideas and methodology of free software to social areas and free culture in general. Thus, it provides multiple web services (hosting, mailing lists, wiki, ftp, forums…) to social/cultural/artistic projects as long as they share their contents with Creative Commons licenses (or other free/libre licenses).","http://ourproject.org","","admins@ourproject.org","http://ourproject.org/op/contact.php","Grass Roots Organization Or Community Network","","not for profit organization","2002-01-01 00:00:00","English, Spanish","","free software, free knowledge, free culture, project hosting","Free software social networks and platforms","Collage","Resource, Service, Methodology","Other","Open Source License","","Comunes Collective","",""
"Lorea","Lorea is a project to create secure social cybernetic systems, in which a network of humans will become simultaneously represented on a virtual shared world. Its aim is to create a distributed and federated nodal organization of entities with no geophysical territory, interlacing their multiple relationships through binary codes and languages.","https://lorea.org","https://github.com/lorea","federation@lorea.org","https://n-1.cc/g/lorea/","Grass Roots Organization Or Community Network","","not for profit organization","2010-01-01 00:00:00","English, Spanish","","federated network, social network platform, social network","FLOSS communities, Free software social networks and platforms","Album","Resource, Service, Methodology","Other","Open Source License","Multiple","Multiple","",""
"Open Source Ecology","By weaving open source permacultural and technological cycles together, we intend to provide basic human needs while being good stewards of the land, using resources sustainably, and pursuing right livelihood. With the gift of openly shared information, we can produce industrial products locally using open source design and digital fabrication. This frees us from the need to participate in the wasteful resource flows of the larger economy by letting us produce our own materials and components for the technologies we use.","http://opensourceecology.org","http://opensourceecology.org/wiki/Volunteer, https://twitter.com/OSEcology, https://www.facebook.com/OpenSourceEcology","ops@opensourceecology.org","","Grass Roots Organization Or Community Network","United Kingdom","not for profit organization","2004-01-01 00:00:00","English","","","Open technology, Citizen science","Physical resource","Resource, Design","Other","Open Source License","","","",""
"Farmhack","Open Source comunity for resilient agriculture","http://farmhack.net/home/","https://twitter.com/NYFCNYFC, http://feeds.feedburner.com/nyfc, https://www.facebook.com/pages/The-National-Young-Farmers-Coalition/157485677636655","info@youngfarmers.org","","Grass Roots Organization Or Community Network","United Kingdom","not for profit organization","2009-01-01 00:00:00","English","","","Community networks, Open technology, Citizen science","Album","Resource, Design","Creative Commons: Attribution-ShareAlike (CC BY-SA)","GNU General Public License V2","","","",""
"Wikispeed","Wikispeed is an automotive manufacturer that produces modular cars. Wikispeed innovates by applying scrum development techniques borrowed from the software world. They use open source tools and lean management methods to improve their productivity","http://wikispeed.org","https://www.facebook.com/WIKISPEED, https://twitter.com/WIKISPEED","info@WIKISPEED.com","","Academia And Research","United Kingdom","not for profit organization","2006-01-01 00:00:00","English","+1 425-312-3996 ","","Open technology, Open design","Physical resource","Resource, Design","Other","Open Source License","","Wordpress","",""
"Makerplane","Open source aviation developed by contributors and volunteers","http://makerplane.org","http://twitter.com/@makerplane, http://www.facebook.com/MakerPlane","","http://makerplane.org/forum","Academia And Research","United Kingdom","not for profit organization","2011-01-01 00:00:00","English","+1 6137001294","","Open technology, Collaborative research","Physical resource","Resource, Design","GNU General Public License","GNU General Public License V2","","","",""
"Protei","Protei is Shape Shifting, Open Hardware, Sailing robot to sense and clean the oceans. Originally invented to clean up the BP Oil Spill pulling long oil sorbent using wind power by Cesar Harada, Protei is now a platform technology to transport scientific payload and clean-up equipment at sea, developed by an global community of scientists, engineers, makers and sailors. You can get involved too.","http://protei.org","https://www.facebook.com/groups/opensailing/, http://www.flickr.com/groups/protei/, http://www.linkedin.com/groups/Open-H2O-4425450?trk=myg_ugrp_ovr","contact@protei.org","","Academia And Research","","other","2011-01-01 00:00:00","English","+33 651884476 ","","Open hardware, Open technology","Physical resource","Design","Other","Open Source License","","","",""
"Wikihouse","WikiHouse is an open-source project for designing and building houses. It endeavors to democratize and simplify the construction of sustainable, resource-light dwellings. WikiHouse is being developed collaboratively by a small – but growing – community of people all around the world. There is no fixed design 'team' or 'studio', but a steadily growing community of designers from all disciplines who share in common the belief that developing freely available design solutions which are affordable, sustainable, and adaptive to differing needs is a worthwhile aim.","http://www.wikihouse.cc/community","http://twitter.com/wikihouse, http://github.com/thruflo/wikihouse","press@wikihouse.cc","","Academia And Research","United Kingdom","not for profit organization","2011-01-01 00:00:00","English","","","Open technology","Physical resource","Resource, Design","Other","Open Source License","","","",""
"SETI@home","SETI@home (""SETI at home"") is an Internet-based public volunteer computing project employing the BOINC software platform, hosted by the Space Sciences Laboratory, at the University of California, Berkeley, in the United States. SETI is an acronym for the Search for Extra-Terrestrial Intelligence. Its purpose is to analyze radio signals, searching for signs of extra terrestrial intelligence, and is one of many activities undertaken as part of SETI. Everyone can participate by running a free program that downloads and analyzes radio telescope data obtained.","http://setiathome.berkeley.edu","https://twitter.com/setiathome, https://www.facebook.com/pages/SETIhome/16063264533","sitihome@home.com","http://seti.berkeley.edu/seti_drupal/?q=contact","Academia And Research","United Kingdom","public institution","1999-01-01 00:00:00","English","","","Collaborative research, Citizen science","Collage","Resource, Service","Other","Open Source License","","","",""
"OSP","The OpenScience project is dedicated to writing and releasing free and Open Source scientific software. We are a group of scientists, mathematicians and engineers who want to encourage a collaborative environment in which science can be pursued by anyone who is inspired to discover something new about the natural world.

Much of the work of science depends on having appropriate tools available to analyze experimental data and to interract with theoretical models. Powerful computers are now cheap enough so that significant processing power is within reach of many people. The missing piece of the puzzle is software that lets the scientist choose between models and make sense of his or her observations. That is where the OpenScience project can help.","http://opensciencefederation.com","https://www.facebook.com/OpenScienceFramework, https://twitter.com/openscience, https://plus.google.com/117417705451874519785/about","brian.glanz@opensciencefederation.org","","","United Kingdom","not for profit organization","2012-01-01 00:00:00","English"," +1 206.289.0575","","Open science","Exchange","Resource, Service","Public Domain","Open Source License","","","",""
"OKF/ Open Knowledge Foundation","The Open Knowledge Foundation is a non-profit organisation founded in 2004 and dedicated to promoting open data and open content in all their forms – including government data, publicly funded research and public domain cultural content.","http://okfn.org","https://twitter.com/OKFN, https://www.facebook.com/OKFNetwork","","http://okfn.org/contact","","United Kingdom","not for profit organization","2004-01-01 00:00:00","English","","","FLOSS communities, Collaborative research, Open science, Open data commons","Collage","Resource, Service, Design, Methodology","Creative Commons: Attribution (CC BY)","Open Source License","","","",""
"Appropedia","Appropedia is an project for development of open-source-appropriate technology","http://www.appropedia.org","http://www.facebook.com/appropedia, http://www.twitter.com/appropedia, http://identi.ca/appropedia, http://www.youtube.com/appropedia","info@appropedia.org","","","United Kingdom","not for profit organization","2006-01-01 00:00:00","English","+1  7077374273 ","","Collaborative research","Collage","Resource, Design","Creative Commons: Attribution (CC BY)","Creative commons: BY-SA 3.0","","","",""
"Wikiprogress","Wikiprogress is the official platform for the OECD-hosted Global Project on ""Measuring the Progress of Societies"". The core mission of wikiprogress is ""to create global information tool supported by a worldwide partnership of organisations and individuals wishing to develop new, smarter measures of progress. Wikiprogress aims to provide a health check for all societies that enables every citizen to better understand the economic, social and environmental factors that determine whether or not their lives are getting better."" The idea is not just to develop progress indicators, but creating a community working together to determine what and how we measure the well-being of societies. Such decisions can not be taken by a single organisation or NSO, but by individuals, governments, and organisations all over the world.","http://www.wikiprogress.org","http://www.facebook.com/pages/Wikiprogress/144756703655, http://twitter.com/wikiprogress, http://www.youtube.com/user/wikiprogress, http://www.linkedin.com/company/877099, http://feeds.feedburner.com/WikiprogressRssFeed","info@wikiprogress.org","","","United Kingdom","public institution","2009-01-01 00:00:00","English","","","Collaborative research","Collage","Service, Methodology","Creative Commons: Attribution-NonCommercial-ShareAlike (CC BY-NC-SA)","Open Source License","","Mediawiki","",""
"Project Gutenberg (PG)","Project Gutenberg is a volunteer effort to digitize and archive cultural works, to ""encourage the creation and distribution of eBooks"". It was founded in 1971 by Michael S. Hart and is the oldest digital library. Most of the items in its collection are the full texts of public domain books. The project tries to make these as free as possible, in long-lasting, open formats that can be used on almost any computer. As of March 2013, Project Gutenberg claimed over 42,000 items in its collection.","http://www.gutenberg.org","https://twitter.com/gutenberg_org, https://www.facebook.com/pages/Project-Gutenberg/103974322971990","  errata2010@pglaf.org","","","United Kingdom","not for profit organization","1984-01-01 00:00:00","English","","","Collaborative archive","Album","Resource, Service","The Project Gutenberg License","Private software","Public Domain","","",""
"Project Madurai","Project Madurai is an open and voluntary initiative to collect and  publish free electronic editions of ancient tamil literary classics.  This means either typing-in or scanning old books and archiving the text  in one of the most readily accessible formats (""ETEXTS"") for use on all popular computer platforms. All etexts will be distributed in both  web/html and PDF formats.- Distributed through the World Wide Web  servers , anyone located anywhere may download a copy for personal use  or read what we publish on the internet, free of charge.","http://www.projectmadurai.org","","pmadurai@gmail.com","","","United Kingdom","not for profit organization","1998-01-01 00:00:00","English","","","Collaborative archive","Album","Resource","Public Domain","Public Domain","","","",""
"Flok Society","Free/Libre Open Knowledge Society, designing a world for the commons","http://floksociety.org","https://twitter.com/FLOKSociety, https://www.facebook.com/FLOKSociety","","http://floksociety.org/contacto/","","United Kingdom","not for profit organization","2012-01-01 00:00:00","English","","","FLOSS communities, Community networks, Free software social networks and platforms, Collaborative research, Open education, P2P economy, Open data commons","Collage","Resource, Service","Creative Commons: Attribution-ShareAlike (CC BY-SA)","Creative commons: BY-SA 3.0","","","",""
"HELibTech","The aim of HELibTech is to provide a starting point for anyone interested in library technology in Higher Education. The focus is UK but most of the issues will be relevant elsewhere. Free and open community resource","http://helibtech.com","https://twitter.com/helibtech","ken@kenchadconsulting.com ","","","United Kingdom","for profit organization","2010-01-01 00:00:00","English","","","Open education","Collage","Resource, Service","Creative Commons: Attribution-ShareAlike (CC BY-SA)","Creative commons: BY-SA 3.0","","","",""
"Thingspeak","ThingSpeak is an open source “Internet of Things” application and API to store and retrieve data from things using HTTP over the Internet or via a Local Area Network. With ThingSpeak, you can create sensor logging applications, location tracking applications, and a social network of things with status updates.","https://thingspeak.com","http://www.twitter.com/thingspeak, http://feeds.feedburner.com/internetofthings, https://github.com/iobridge/ThingSpeak","support@thingspeak.com","","","United Kingdom","for profit organization","2010-01-01 00:00:00","English","","","Internet of things","Collage","Resource, Design","Other","Open Source License","","","",""
"Open source robotics Foundation","Open Source Robotics Foundation, Inc. (OSRF) is an independent non-profit organization founded by members of the global robotics community. The mission of OSRF is to support the development, distribution, and adoption of open source software for use in robotics research, education, and product development.","http://www.osrfoundation.org","https://plus.google.com/109176055042429289073/posts, https://twitter.com/OSRFoundation","info@osrfoundation.org","http://osrfoundation.org/involvement.html","","United Kingdom","not for profit organization","2013-01-01 00:00:00","English","+1.650.450.9681 ","","Open technology, Open science","Physical resource","Resource, Service","Creative Commons: Attribution (CC BY)","Other licenses","","","Press: tsmith@elementpr.com ",""
"Wikimapia","Wikimapia is a multilingual open-content collaborative map, where anyone can create place tags and share their knowledge. The goal is to describe the whole world by compiling as much useful information about all geographical objects as possible, organize it and provide free access to our data for public domain.","http://wikimapia.org","https://twitter.com/search?q=wikimapia&src=typd, https://www.facebook.com/pages/WikiMapia/109363129082838#","contact@wikimapia.org","","","United Kingdom","for profit organization","2006-01-01 00:00:00","English","","","Collaborative mapping","Collage","Resource, Service, Methodology","Creative Commons: Attribution-ShareAlike (CC BY-SA)","Creative commons: BY-SA 3.0","","Google maps","",""
"Blender","Blender is a free and open-source 3D computer graphics software product used for creating animated films, visual effects, art, 3D printed models, interactive 3D applications and video games. Blender's features include 3D modeling, UV unwrapping, texturing, rigging and skinning, fluid and smoke simulation, particle simulation, soft body simulation, sculpting, animating, match moving, camera tracking, rendering, video editing and compositing. It also features a built-in game engine.","http://www.blender.org/","https://twitter.com/blender3d, https://www.facebook.com/blender.3d","foundation@blender.org","","","United Kingdom","not for profit organization","1998-01-01 00:00:00","English","","","Open design","Exchange","Service, Design","Other","GNU General Public License V2","","","",""
"Sourcefabric","Company that provide news organisations with the software, expertise and support to produce it online, in print and on air. Sourcefabric is established as a Czech non-profit organisation with  its headquarters in Prague, branches in Berlin and Toronto, and  representatives in Minsk, Guatemala, Warsaw, Belgrade and Cluj. Sourcefabric’s products are built by news experts and a highly  skilled team of over 30 technical officers, developers, system administrators and quality assurance engineers. Newscoop (open content management for newspapers & magazines), Airtime (open source radio automation) and Booktype (open source publishing platform for print and digital books) are currently on the market (each is downloaded over 10,000 times a year).","http://www.sourcefabric.org","http://twitter.com/sourcefabric, http://www.facebook.com/Sourcefabric, http://vimeo.com/sourcefabric, http://www.flickr.com/photos/sourcefabric, https://identi.ca/sourcefabric","contact@sourcefabric.org","","","United Kingdom","not for profit organization","2010-01-01 00:00:00","English","","","Others","Other","Others","Other","Creative commons: BY-SA 3.0","","","",""
"Booktype","Booktype is a free and open source oftware for authoring, collaborating, editing, and publishing books to PDF, ePub, .mobi, ODT and HTML formats. It was launched by Sourcefabric in February 2012 when Booktype evolved from the Booki software, which powers FLOSS Manuals.","http://www.sourcefabric.org/en/booktype/","https://www.facebook.com/Booktype, https://twitter.com/Sourcefabric, http://vimeo.com/sourcefabric, http://www.flickr.com/photos/sourcefabric, http://www.youtube.com/user/Sourcefabric, https://github.com/sourcefabric","contact@sourcefabric.org","http://www.sourcefabric.org/en/about/contactus","","United Kingdom","not for profit organization","2012-01-01 00:00:00","English","+420 222362540","","Collaborative writing","Collage","Resource, Methodology","Creative Commons: Attribution (CC BY)","AGPL license","","","Centre for Social Innovation
720 Bathurst St. Suite 203
Toronto, Ontario
M5S 2R4
Canada",""
"Flossmanuals","The FLOSS Manuals (FM) is a non-profit foundation founded in 2006 and based in the Netherlands. The foundation is focused on the creation of quality documentation about how to use free software. Its web site is a wiki (previously using the TWiki software, now developed as an autonomous platform with Booki) focused on the collaborative authoring of manuals. The documentation is licensed under the GPL. Although initially the manuals were covered by the GFDL, the license was changed due to concerns about the limited and non-free nature of the GFDL","http://www.flossmanuals.net","http://www.flossmanuals.org/rss.xml, https://twitter.com/flossmanuals, https://www.facebook.com/FLOSSManualsSuomi?directed_target_id=0&filter=2","","http://lists.flossmanuals.net/listinfo.cgi/discuss-flossmanuals.net","","United Kingdom","not for profit organization","2006-01-01 00:00:00","English","","","FLOSS communities, Collaborative writing, Others","Collage","Resource, Methodology","GNU General Public License","GNU General Public License V2","","","",""
"Openp2pdesign.org","Open P2P Design was developed at the intersection of many different disciplines, processes and tools, in order to make it possible for a community to co-design a collaborative activity in which to participate together. The methodology takes concepts, processes and tools from Activity Theory (Psychology), Service Design, Social Network Analysis, Action Planning (Urbanism) in order to design an activity in a collaborative way: with Open P2P Design we can analyze, design or re-design an existing or a new activity taking into account both the community and the business that enable it.","http://www.openp2pdesign.org","http://www.facebook.com/openp2pdesign.org, https://twitter.com/search?q=%40openp2pdesign%20&src=typd, https://github.com/openp2pdesign","info@openp2pdesign.org","","","","","2005-01-01 00:00:00","English","+1 375950118 ","","Open design","Exchange","Design","Creative Commons: Attribution (CC BY)","Open Source License","","","",""
"RepRap Project","The RepRap project is an initiative to develop a 3D printer that can print most of its own components. RepRap (short for replicating rapid prototyper) uses a variant of fused deposition modeling, an additive manufacturing technique. The project calls it Fused Filament Fabrication (FFF) to avoid trademark issues around the ""fused deposition modeling"" term.","http://reprap.org/wiki/RepRap","https://twitter.com/RepRapCentral, https://www.facebook.com/pages/RepRap-Project/111911162158686","support@reprappro.com","","","United Kingdom","for profit organization","2013-01-01 00:00:00","English","","","Open technology","Physical resource","Design, Others","GNU Free Documentation License","Open Source License","","","",""
"Cooperativa Integral Catalana","An Integral Cooperative is a tool to create a grassroots counterpower departing  from self-management, self-organization and direct democracy. Cooperativa Integral Catalana is a catalan territorial based network of social and economic Cooperatives. ","http://cooperativa.cat/es/","https://twitter.com/CoopIntegral, https://www.facebook.com/CooperativaIntegralCatalana"," info@cooperativaintegral.cat","","","United Kingdom","not for profit organization","2010-01-01 00:00:00","Catalan","+34  935 535 611","","FLOSS communities, Open design, P2P economy, Hacklabs / Collaborative spaces","Space","Resource, Methodology","Creative Commons: Attribution-ShareAlike (CC BY-SA)","Other licenses","Community based","","",""
"Skype","Skype is a freemium voice-over-IP service and instant messaging client, developed by the Microsoft Skype Division. Is a hybrid peer-to-peer and client–server system. It makes use of background processing on computers running Skype software, and this is reflected in Skype's original proposed name of Sky Peer-to-Peer.","http://www.skype.com","https://twitter.com/Skype, https://www.facebook.com/Skype","contactus@skype.net","","","United Kingdom","for profit organization","2003-01-01 00:00:00","Danish, English, French, Italian, Japanese, Portuguese, Spanish, Other","","","Community networks","Album","Service","Other","Open Source License","","","",""
