"GNOME","GNOME is a desktop environment and graphical user interface (GUI) that runs on top of a computer operating system. It is composed entirely of free and open source software and is developed by both volunteers and paid contributors, the largest corporate contributor being Red Hat.","http://www.gnome.org/","https://twitter.com/gnome, https://planet.gnome.org/, https://identi.ca/gnome","","","Grass Roots Organization Or Community Network","21 Orinda WayOrinda, CA 94563United States","not for profit organization","1999-01-01 00:00:00","English","","GUI, desktop","FLOSS communities","Collage","Resource","Creative Commons: Attribution (CC BY)","GNU General Public License V2","GNOME Foundation","GNOME Foundation","",""
"Ututo","Ututo is a Linux distribution consisting entirely of free software. The name makes reference to a gecko known by this name from northern Argentina.","http://proyecto.ututo.net","","","http://proyecto.ututo.net/cmsd/contact","Grass Roots Organization Or Community Network","","other","2000-01-01 00:00:00","Spanish","","","FLOSS communities","Collage","Resource","GNU General Public License","GNU General Public License V2","","","",""
"Gentoo","Gentoo is a free operating system based on either Linux or FreeBSD that can be automatically optimized and customized for just about any application or need. Extreme configurability, performance and a top-notch user and developer community are all hallmarks of the Gentoo experience. ","http://www.gentoo.org/","","","http://www.gentoo.org/main/en/lists.xml","Grass Roots Organization Or Community Network","","other","2002-01-01 00:00:00","English","","","FLOSS communities","Collage","Resource","GNU General Public License","GNU General Public License V2","","","",""
"La Casika","The autonomous squatted social center LA CASIKA is an old and big house sited in the center of Mostoles, a town closed to Madrid (17 km).

In these years of history have been a lot of groups working from the social side, like feminist, antifascists, ecologist, youth or just neighbors, making of La Casika a very well known space. In fact, we can say that now it´s a reference for the squatter movement in Madrid: everybody knows, and everybody loves it.","http://lacasika.ourproject.org/","https://twitter.com/CSOlaCasiKa"," mostoleslacasika@gmail.com","http://lacasika.ourproject.org/contact","Grass Roots Organization Or Community Network","C/ Montero 1528934 Móstoles MadridSpain","other","1997-01-01 00:00:00","Spanish","","social center, squatter, neighborhood","Urban commons, Hacklabs / Collaborative spaces","Space","Resource, Others","Other","Other licenses","","","",""
"La Piluka","The cultural social center La Piluka is an autonomous self-managed space for sharing resources, knowledge and political action in the Barrio del Pilar neighborhood (Madrid)","http://www.lapiluka.org/","","info@lapiluka.org","http://www.lapiluka.org/acerca-de/contacto/","Grass Roots Organization Or Community Network","Plaza de Corcubión, 1628029 Madrid MadridSpain","not for profit organization","2000-01-01 00:00:00","Spanish","+34 917304527","cultural, social, center, barrio del pilar, madrid","Community networks, Collaborative consumption, Urban commons, Hacklabs / Collaborative spaces","Space","Resource","Public Domain","Other licenses","Asociación Cultural Expresiones","Hetzner Online AG","",""
"World Wide Web Consortium (W3C)","The World Wide Web Consortium (W3C) is an international community that develops open standards to ensure the long-term growth of the Web. 

On 29 August 2012 five leading global organizations jointly signed an agreement to affirm and adhere to a set of Principles in support of The Modern Paradigm for Standards; an open and collectively empowering model that will help radically improve the way people around the world develop new technologies and innovate for humanity. Learn more about OpenStand: the modern paradigm for standards.","http://www.w3c.org/","https://twitter.com/W3C, https://identi.ca/w3c","","http://www.w3.org/Consortium/contact","Academia And Research","","not for profit organization","1994-01-01 00:00:00","Arabic, Chinese, Dutch, English, French, German, Greek, Hebrew, Hindi, Hungarian, Italian, Korean, Portuguese, Spanish, Swedish","","web, html, http, standards","Internet protocol","Collage","Resource, Internet protocol","Other","No license","World Wide Web Consortium","World Wide Web Consortium","Though there are community groups, which are open, in core standard groups membership is required to participate",""
"Claroline","Claroline is an Open Source software to easily deploy a platform for learning and collaboration online. Available in many languages, Claroline can be downloaded free and installed freely.
Claroline is based on a flexible educational model that information becomes knowledge through the activities and productions of the learner in a system driven by the motivation and interaction. The wide range of tools made available to the user allows any instructor or student to establish or operate an educational device for learning. The generic tools (calendar, documents, forums, …) can use the platform in various contexts.","http://www.claroline.net","https://twitter.com/LMSClaroline","info@claroline.net","","Academia And Research","Grand Rue, 541348 Louvain-La-NeuveBelgium","not for profit organization","2000-01-01 00:00:00","English, French, Spanish","","","FLOSS communities, Open education","Collage","Resource, Methodology","GNU General Public License","GNU General Public License V2","Claroline Consortium","Claroline Consortium","",""
"CiviCRM","CiviCRM is a web-based, internationalized suite of computer software for constituency relationship management, that falls under the broad rubric of customer relationship management. It is specifically designed for the needs of non-profit, non-governmental, and advocacy groups, and serves as an association management system. CiviCRM is designed to manage information about an organization's donors, members, event registrants, subscribers, grant application seekers and funders, and case contacts. Volunteers, activists, voters as well as more general sorts of business contacts such as employees, clients, or vendors can be managed using CiviCRM.","https://civicrm.org/contact","https://twitter.com/civicrm","","https://civicrm.org/contact","","","other","2005-01-01 00:00:00","English","","","FLOSS communities, Community networks, Citizen media","Collage","Resource, Service","GNU General Public License","AGPL license","","","",""
"Opigno","Opigno is a Learning Management System based on Drupal. It has been design to be fully integrated with any Drupal platform (website, intranet, extranet, ...) and offer a maximum flexibility to be extended.","https://www.opigno.org","https://twitter.com/Opigno","","https://www.opigno.org/en/contact","Business","Tresi 6CH-1028 PréverengesSwitzerland","for profit organization","","English","+41. 21.800.00.10","","FLOSS communities","Collage","Resource, Service","GNU General Public License","GNU General Public License V2"," Connect-i"," Connect-i","",""
"Sakai","Sakai is a community of academic institutions, commercial organizations and individuals who work together to develop a common Collaboration and Learning Environment (CLE). ","http://www.sakaiproject.org","","","","Academia And Research","","not for profit organization","2005-01-01 00:00:00","English, Spanish","","","FLOSS communities, Open education","Collage","Resource","Other","Other licenses","","","",""
"Calafou","Since its inception, the intent is to develop a network based on a network of cooperatives, individual projects and housing in a collectivised area.This seeks to facilitate the sharing of ideas, goods and resources to foster synergies in a natural way. A place for social innovation, technology and policy based on self-responsibility and cooperation. A project where the productive economies are in the service of people allowing their needs for access to resources and tools are not obstacles to the realization of their creative potential.","https://calafou.org","","calafou@cooperativaintegral.cat ","https://calafou.org/en/content/contact","Grass Roots Organization Or Community Network","Ca la Fou, Camí de Ca la Fou, s/n08785 Vallbona d´Anoia (Barcelona) CataloniaSpain","other","2012-01-01 00:00:00","Catalan, English, Spanish","+34 912 692 271","","Urban commons, Hacklabs / Collaborative spaces, Others","Space","Resource, Methodology, Others","Other","GNU General Public License V2","","","",""
"LibreOffice","LibreOffice is a free and open source office suite, developed by The Document Foundation. It was forked from OpenOffice.org in 2010. The LibreOffice suite comprises programs to do word processing, spreadsheets, slideshows, diagrams and drawings, maintain databases, and compose math formulae.","https://www.libreoffice.org","https://twitter.com/libreoffice","","https://www.libreoffice.org/about-us/","Social Enterprise Charity Or Foundation","Germany","not for profit organization","2011-01-01 00:00:00","English","","","FLOSS communities","Collage","Resource","Creative Commons: Attribution (CC BY)","GNU General Public License V3","The Document Foundation","The Document Foundation","",""
"Jenkins","Jenkins is an open source continuous integration tool written in Java. The project was forked from Hudson after a dispute with Oracle.","http://jenkins-ci.org/","https://twitter.com/jenkinsci","","http://jenkins-ci.org/content/mailing-lists","","","other","2005-01-01 00:00:00","English","","","FLOSS communities","Collage","Resource","Creative Commons: Attribution (CC BY)","GNU General Public License V2","","","",""
"Texmaker","Texmaker is a free, modern and cross-platform LaTeX editor for linux, macosx and windows systems that integrates many tools needed to develop documents with LaTeX, in just one application.","http://www.xm1math.net/texmaker/","","","","","","other","2003-01-01 00:00:00","English","","","FLOSS communities","Collage","Resource","GNU General Public License","GNU General Public License V2","","","",""
"Bottle","Bottle is a fast, simple and lightweight WSGI micro web-framework for Python. It is distributed as a single file module and has no dependencies other than the Python Standard Library.","http://bottlepy.org","","","http://bottlepy.org/docs/dev/contact.html","","","other","2009-01-01 00:00:00","English","","","FLOSS communities","Collage","Resource","Other","MIT License","Marcel Hellkamp","Ezcluster","",""
"Wireshark","Wireshark is a free and open-source packet analyzer. It is used for network troubleshooting, analysis, software and communications protocol development, and education. Originally named Ethereal, in May 2006 the project was renamed Wireshark due to trademark issues.","http://www.wireshark.org","","","http://www.wireshark.org/lists/","Social Enterprise Charity Or Foundation","","not for profit organization","2006-01-01 00:00:00","English","","","FLOSS communities","Collage","Resource","GNU General Public License","GNU General Public License V2","Wireshark Foundation","Wireshark Foundation","",""
"OpenBSD","OpenBSD is a Unix-like computer operating system descended from Berkeley Software Distribution (BSD), a Unix derivative developed at the University of California, Berkeley. It was forked from NetBSD by project leader Theo de Raadt in late 1995. As well as the operating system, the OpenBSD Project has produced portable versions of numerous subsystems, most notably PF, OpenSSH and OpenNTPD, which are very widely available as packages in other operating systems.","http://www.openbsd.org/","","","","","","other","1996-01-01 00:00:00","English","","","FLOSS communities","Collage","Resource","Other","BSD License","","","",""
"Prism Break","Directory with alternative software (mostly FLOSS) to Opt out of global data surveillance programs like PRISM, XKeyscore and Tempora.","https://prism-break.org","","","","Grass Roots Organization Or Community Network","","not for profit organization","2013-01-01 00:00:00","English","","","FLOSS communities, Community networks, Open technology, Free software social networks and platforms","Album","Resource, Service","GNU General Public License","GNU General Public License V3","Peng Zhong","Peng Zhong","",""
"gNewSense","gNewSense is a computer operating system, originally based on Ubuntu and later upon Debian, and developed with sponsorship from the Free Software Foundation. Its goal is user-friendliness, but with all proprietary (e.g. binary blobs) and non-free software removed.","http://www.gnewsense.org/","","","","Grass Roots Organization Or Community Network","","not for profit organization","2006-01-01 00:00:00","English","","","FLOSS communities","Collage","Resource","GNU Free Documentation License","GNU General Public License V2","","","",""
"Tor","Tor is free software and an open network that helps you defend against traffic analysis, a form of network surveillance that threatens personal freedom and privacy, confidential business activities and relationships, and state security.","https://www.torproject.org/","","","","","7 Temple Street, Suite ACambridge, MA 02139United States","not for profit organization","2002-01-01 00:00:00","English","","","FLOSS communities","Collage","Resource","Other","BSD License","Tor Project","Tor Project","",""
"GNUnet","GNUnet is a framework for secure peer-to-peer networking that does not use any centralized or otherwise trusted services. Our high-level goal is to provide a strong free software foundation for a global network that provides security and in particular respects privacy.

GNUnet started with an idea for anonymous censorship-resistant file-sharing, but has grown to incorporate other applications as well as many generic building blocks for secure networking applications. In particular, GNUnet now includes the GNU Name System, a privacy-preserving, decentralized public key infrastructure.","https://gnunet.org/","","","https://gnunet.org/contact_information","Academia And Research","","not for profit organization","2001-01-01 00:00:00","English","","","FLOSS communities","Collage","Resource","GNU Free Documentation License","GNU General Public License V2","","","",""
"Apache Lucene","Apache LuceneTM is a high-performance, full-featured text search engine library written entirely in Java. It is a technology suitable for nearly any application that requires full-text search, especially cross-platform.","http://lucene.apache.org/core/","","","http://lucene.apache.org/core/discussion.html","Social Enterprise Charity Or Foundation","","not for profit organization","1999-01-01 00:00:00","English","","","FLOSS communities","Collage","Resource","Other","Other licenses","","","Release under the Apache License: http://www.apache.org/licenses/LICENSE-2.0",""
"PHP-Nuke","PHP-Nuke is a news automated system specially designed to be used in Intranets and Internet. The Administrator has total control of his web site, registered users, and he will have in the hand a powerful assembly of tools to maintain an active and 100% interactive web site using databases.","https://www.phpnuke.org","","","https://downloads.phpnuke.org/en/email/contact_us.htm","Business","9 Urano Street28925 Alcorcón MadridSpain","for profit organization","2000-01-01 00:00:00","English","","","FLOSS communities","Collage","Resource, Service","GNU General Public License","GNU General Public License V2","Bibado Investments S.L","Bibado Investments S.L","",""
"Symfony","Symfony is a PHP Web Development Framework.","http://symfony.com","","","http://symfony.com/mailing-lists","","","other","2005-01-01 00:00:00","English","","","FLOSS communities","Exchange","Resource","Other","MIT License","","","",""
"Moodle","Moodle is a learning platform designed to provide educators, administrators and learners with a single robust, secure and integrated system to create personalised learning environments. You can download the software onto your own web server or ask one of our knowledgable Moodle Partners to assist you.

Moodle is built by the Moodle project which is led and coordinated by Moodle HQ, an Australian company of 30 developers which is financially supported by a network of 60 Moodle Partner service companies worldwide. ","https://moodle.org/","","","","","","not for profit organization","2002-01-01 00:00:00","English","","","FLOSS communities, Open education","Collage","Resource","GNU General Public License","GNU General Public License V3","","","",""
"Wikisaber","Wikisaber is an educational portal for teachers, students and parents based on collaborative learning. ","http://www.wikisaber.es","https://twitter.com/wikisaber_es, https://www.facebook.com/wikisaber.es","info@wikisaber.es","http://www.wikisaber.es/wikisaber/Contacto.aspx","Social Enterprise Charity Or Foundation","Serrano 10728006 Madrid MadridSpain","not for profit organization","2009-01-01 00:00:00","Spanish","+34 915 775 585","","Collaborative writing, Collaborative video, audio, images, Collaborative archive, Open education","Album","Service","Copyright","Private software","Fundación Wikisaber","Fundación Wikisaber","The contents from the wiki are under a Creative Commons license (more info at http://www.wikisaber.es/uploadedFiles/T%C3%A9rminos%20legales%20Wikisaber.pdf)",""
"MetricsGrimoire","MetricsGrimoire (pronounced /ˈmetrɪksɡrɪmˈwɑr/) is a toolset to obtain data from repositories related to software development: source code management (aka version control) and issue tracking (aka bug reporting) systems, mailing lists, etc. Data and metadata about the software development processes is retrieved from those repositories (information about commits, ticket management, communication in mailing lists, etc.), and then organized and stored into SQL databases that can later be mined for specific patterns or summaries of activity.","http://metricsgrimoire.github.io/","","","","Academia And Research","","not for profit organization","","English, Spanish","","","FLOSS communities","Collage","Resource","GNU General Public License","GNU General Public License V2","","","",""
"Piwik","Piwik is an open analytics platform currently used by individuals, companies and governments all over the world. With Piwik, your data will always be yours.","http://piwik.org","","","","","","other","2007-01-01 00:00:00","English","","","FLOSS communities","Collage","Resource","GNU General Public License","GNU General Public License V3","","","",""
"phpMyAdmin","phpMyAdmin is a free software tool written in PHP, intended to handle the administration of MySQL over the Web. phpMyAdmin supports a wide range of operations on MySQL, MariaDB and Drizzle. Frequently used operations (managing databases, tables, columns, relations, indexes, users, permissions, etc) can be performed via the user interface, while you still have the ability to directly execute any SQL statement. ","http://www.phpmyadmin.net","","","","","","not for profit organization","2001-01-01 00:00:00","English","","","FLOSS communities","Collage","Resource","GNU General Public License","GNU General Public License V2","","","",""
"Ohloh","Ohloh is a free, public directory of Free and Open Source Software and the contributors who create and maintain it. Ohloh Code is a publicly available, free code search site that indexes most of the projects in Ohloh.

Ohloh is editable by everyone, like a wiki. All are welcome to join and add new projects, and to make corrections to existing project pages. This public review helps to make Ohloh one of the largest, most accurate, and up-to-date FOSS software directories available. We encourage contributors to join Ohloh and claim their commits on existing projects and add projects not yet on Ohloh, to assemble a complete profile of all their FOSS code contributions.

Ohloh is not a forge — it does not host projects and code. Ohloh is a directory, a community, and analytics and search services. By connecting to project source code repositories, analyzing both the code’s history and ongoing updates, and attributing those updates to specific contributors, Ohloh can provide reports about the composition and activity of project code bases, and aggregate this data to track the changing demographics of the FOSS world.","http://www.ohloh.net/","","nfo@ohloh.net","http://meta.ohloh.net/us/","Business","8 New England Executive ParkBurlington, MA 01803United States","for profit organization","2006-01-01 00:00:00","English","781.891.5100","","FLOSS communities, Community networks","Album","Resource, Service","Creative Commons: Attribution (CC BY)","Private software","Black Duck Software","Black Duck Software","",""
"GIMP"," GIMP is an acronym for GNU Image Manipulation Program. It is a freely distributed program for such tasks as photo retouching, image composition and image authoring.

It has many capabilities. It can be used as a simple paint program, an expert quality photo retouching program, an online batch processing system, a mass production image renderer, an image format converter, etc.

GIMP is expandable and extensible. It is designed to be augmented with plug-ins and extensions to do just about anything. The advanced scripting interface allows everything from the simplest task to the most complex image manipulation procedures to be easily scripted. ","http://www.gimp.org/","","","http://www.gimp.org/webmasters.html","","","other","1996-01-01 00:00:00","English","","","FLOSS communities","Collage","Resource","GNU General Public License","GNU General Public License V3","","","",""
"JabRef","JabRef is an open source bibliography reference manager. The native file format used by JabRef is BibTeX, the standard LaTeX bibliography format. JabRef runs on the Java VM (version 1.6 or newer), and should work equally well on Windows, Linux and Mac OS X.","http://jabref.sourceforge.net/","","","http://jabref.sourceforge.net/contact.php","","","other","2003-01-01 00:00:00","English","","","FLOSS communities","Collage","Resource","GNU General Public License","GNU General Public License V2","","","",""
"Zotero","Zotero is a free and open-source reference management software to manage bibliographic data and related research materials.","https://www.zotero.org/","","","","Academia And Research","4400 University DriveMSN 1E7Fairfax, VA 22030United States","public institution","2006-01-01 00:00:00","English","","","FLOSS communities, Free software social networks and platforms","Collage","Resource, Service","No license","AGPL license","Roy Rosenzweig Center for History and New Media","Roy Rosenzweig Center for History and New Media","",""
"antiX","antiX is a fast, lightweight and easy to install linux live CD distribution based on Debian Testing for Intel-AMD x86 compatible systems. antiX offers users the ""antiX Magic"" in an environment suitable for old computers.","http://antix.mepis.org","","","","Grass Roots Organization Or Community Network","","other","2011-01-01 00:00:00","Catalan, Dutch, English, French, German, Greek, Portuguese, Russian, Spanish, Turkish","","","FLOSS communities","Collage","Resource","Creative Commons: Attribution (CC BY)","GNU General Public License V2","","","",""
"Freecycle Network","The Freecycle Network is a grassroots and entirely nonprofit movement of people who are giving (and getting) stuff for free in their own towns. It's all about reuse and keeping good stuff out of landfills. Each local group is moderated by local volunteers.","https://www.freecycle.org/","","","","Grass Roots Organization Or Community Network","","not for profit organization","2003-01-01 00:00:00","English","","","Collaborative consumption, Others","Physical resource","Others","Copyright","Other licenses","","","",""
"OpenScholar","OpenScholar is open source software built on top of Drupal that allows end users to easily create dynamic and customizable academic web sites. Each site comes with a suite of apps, widgets and themes, enabling users to build and manage feature-rich web sites.
OpenScholar is developed and maintained by The Institute for Quantitative Social Science in collaboration with HPAC and HUIT at Harvard University with contribution from open source community","http://openscholar.harvard.edu/","","","https://drupal.org/project/openscholar","Academia And Research","1737 Cambridge StreetCGIS Knafel Building, Room 350Cambridge, MA 02138United States","public institution","2010-01-01 00:00:00","English","","","FLOSS communities, Free software social networks and platforms","Collage","Resource, Service","No license","GNU General Public License V2","The Institute for Quantitative Social Science (Harvard University)","The Institute for Quantitative Social Science (Harvard University)","",""
"Barrapunto","Barrapunto is a popular Spanish-language Slashdot-like website.","http://barrapunto.com/","","webmaster@barrapunto.com","http://barrapunto.com/contacto.shtml","Business","Luis Mitjans 56Madrid MadridSpain","for profit organization","1999-01-01 00:00:00","Spanish","","","Collaborative writing, Collaborative archive","Collage","Resource","Creative Commons: Attribution (CC BY)","GNU General Public License V2","Barrapunto S.L","Barrapunto S.L","",""
"Menéame","Menéame is a Spanish social news website based in communitary participation, made for users to discover and share content from anywhere on the Internet, by submitting links and stories and voting and commenting on submitted links and stories.","http://www.meneame.net/","","","http://www.meneame.net/legal.php#contact","Business","Calle Simo Ballester 9 bajos07011 Palma de Mallorca BalearesSpain","for profit organization","2005-01-01 00:00:00","Spanish","","","Collaborative writing, Collaborative archive","Album","Resource","Creative Commons: Attribution (CC BY)","AGPL license","Menéame Comunicacions, SL","Menéame Comunicacions, SL","",""
