Index,AgreementId,Name,Region,Country,Peace Process,Peace Process Name,Stage,Signed Date,Agreement/Conflict Level,Conflict Nature,Agreement Status
450,1575,Third high-level policy meeting on the inter-Malian dialogue process ,Africa (excl MENA),Mali/Azawad,74,Mali-Azawad Inter-Azawad peace process,Pre,2014-06-16,Intra,Government/territory,Multiparty signed/agreed
451,1578,"Kalo Htoo Baw (DKBA-5), Government Union-level Peace Agreements",Asia and Pacific,Myanmar,80,Myanmar ceasefires process with ethnic armed groups,Cea,2011-12-11,Intra,Government/territory,Multiparty signed/agreed
452,1579,State-level Ceasefire Agreement between Pa-Oh National Organization (PNLO) and Government,Asia and Pacific,Myanmar,80,Myanmar ceasefires process with ethnic armed groups,Cea,2012-08-25,Intra,Government/territory,Multiparty signed/agreed
453,1580,Union-level agreement between Pa-Oh National Organization (PNLO) and Union Peacemaking Working Committee (UPWC),Asia and Pacific,Myanmar,80,Myanmar ceasefires process with ethnic armed groups,Cea,2013-03-23,Intra,Government/territory,Multiparty signed/agreed
454,1581,7-points Agreement between Myanmar government and Kachin Independence Organization (KIO),Asia and Pacific,Myanmar,80,Myanmar ceasefires process with ethnic armed groups,Cea,2013-05-30,Intra,Government/territory,Multiparty signed/agreed
455,1582,National Democratic Alliance Army (NDAA) Agreed Terms,Asia and Pacific,Myanmar,80,Myanmar ceasefires process with ethnic armed groups,Cea,2011-09-07,Intra,Government/territory,Multiparty signed/agreed
456,1585,Agreement on the Cessation of Hostilities between the Government of the Republic of South Sudan (RSS) and the South Sudan National Liberation Movement/Army (SSNLM/A),Africa (excl MENA),South Sudan,107,South Sudan post-secession process,Cea,2016-04-02,Intra,Government,Multiparty signed/agreed
457,1586,"Dhahran al-Janoub Agreements on the Cessation of Hostilities in Yemen for Shabwah, al-Dhali’, al-Baydah, al-Jawf, Ma’rib, Ta’iz and Terms and Conditions",Middle East and North Africa,Yemen,123,Yemen peace process,Cea,2016-04-10,Intra,Government/territory,Multiparty signed/agreed
458,1587,Protocol (Ilidza Ceasefire),Europe and Eurasia,Bosnia and Herzegovina/Yugoslavia (former),125,Bosnia peace process,Cea,1992-04-23,Intra,Government/territory,Multiparty signed/agreed
459,1588,Ceasefire Agreement,Europe and Eurasia,Bosnia and Herzegovina/Yugoslavia (former),125,Bosnia peace process,Cea,1992-05-05,Intra,Government/territory,Multiparty signed/agreed
460,1589,Agreement (ICRC Humanitarian Principles),Europe and Eurasia,Bosnia and Herzegovina/Yugoslavia (former),125,Bosnia peace process,Pre,1992-06-06,Intra,Government/territory,Multiparty signed/agreed
461,1590,Agreement by the Serbian Republic of Bosnia and Hercegovina with regard to the opening of Sarajevo airport,Europe and Eurasia,Bosnia and Herzegovina/Yugoslavia (former),125,Bosnia peace process,Cea,1992-06-01,Intra,Government/territory,Unilateral document
462,1591,Agreement by the Republic of Bosnia Herzegovina with regard to the Concentration of all Heavy Weapons in and Around Sarajevo,Europe and Eurasia,Bosnia and Herzegovina/Yugoslavia (former),125,Bosnia peace process,Cea,1992-06-01,Intra,Government/territory,Status unclear
463,1596,UN Security Council Resolution 2254,Middle East and North Africa,Syria,115,Syrian peace process,Pre,2015-12-18,InterIntra,Government,Unilateral document
464,1597,Agreement between al-ʿAwlaqī Tribe and al-Qaeda,Middle East and North Africa,Yemen,145,Yemen Inter-group Agreements,Cea,2014-05-02,IntraLocal,Inter-group,Multiparty signed/agreed
465,1599,Deed of Commitment for Peace and National Reconciliation,Asia and Pacific,Myanmar,80,Myanmar ceasefires process with ethnic armed groups,Pre,2015-02-12,Intra,Government/territory,Multiparty signed/agreed
466,1608,Protocol,Europe and Eurasia,Bosnia and Herzegovina/Yugoslavia (former),128,Bosnia Local peace processes,Pre,1992-08-08,Intra,Government/territory,Multiparty signed/agreed
467,1611,Announcement (Ceasefire for Vitez municipality),Europe and Eurasia,Bosnia and Herzegovina/Yugoslavia (former),125,Bosnia peace process,Cea,1992-10-22,Intra,Government/territory,Multiparty signed/agreed
468,1613,Press release,Europe and Eurasia,Bosnia and Herzegovina/Yugoslavia (former),125,Bosnia peace process,Pre,1992-10-23,Intra,Government/territory,Multiparty signed/agreed
469,1615,Agreement Freedom of Movement for Civilians Linked with the Safety of the Airport,Europe and Eurasia,Bosnia and Herzegovina/Yugoslavia (former),125,Bosnia peace process,Pre,1992-12-13,Intra,Government/territory,Multiparty signed/agreed
470,1616,Agreement on the Separation of Forces in the area of Sarajevo Airport (collection of Sarajevo agreements),Europe and Eurasia,Bosnia and Herzegovina/Yugoslavia (former),125,Bosnia peace process,Cea,1992-12-22,Intra,Government/territory,Multiparty signed/agreed
471,1617,Record of agreements processes leading to peace between the HVO and BiH in Gornji Vakuf,Europe and Eurasia,Bosnia and Herzegovina/Yugoslavia (former),125,Bosnia peace process,Cea,1993-01-20,Intra,Government/territory,Multiparty signed/agreed
472,1618,Agreement on an urgent cease-fire between the HVO and the BH Army in Central Bosnia,Europe and Eurasia,Bosnia and Herzegovina/Yugoslavia (former),125,Bosnia peace process,Cea,1993-01-30,Intra,Government/territory,Multiparty signed/agreed
473,1620,Agreement,Europe and Eurasia,Bosnia and Herzegovina/Yugoslavia (former),125,Bosnia peace process,Cea,1993-04-20,Intra,Government/territory,Multiparty signed/agreed
474,1623,Agreement on establishment of the cease-fire on the lines of contact made by LG Ratko Mladic and General Milivoj Petkovic,Europe and Eurasia,Bosnia and Herzegovina/Yugoslavia (former),128,Bosnia Local peace processes,Cea,1993-05-16,Intra,Government/territory,Multiparty signed/agreed
475,1624,Medjugorje Agreement ,Europe and Eurasia,Bosnia and Herzegovina/Yugoslavia (former),125,Bosnia peace process,Imp,1993-05-18,Intra,Government/territory,Multiparty signed/agreed
476,1626,Agreement among the parties to halt the conflict in Central Bosnia,Europe and Eurasia,Bosnia and Herzegovina/Yugoslavia (former),125,Bosnia peace process,Cea,1993-06-09,Intra,Government/territory,Multiparty signed/agreed
477,1627,General agreement to halt the conflict in Bosnia-Herzegovina of 15 June 1993,Europe and Eurasia,Bosnia and Herzegovina/Yugoslavia (former),125,Bosnia peace process,Cea,1993-06-15,Intra,Government/territory,Multiparty signed/agreed
478,1633,Agreement (Ceasefire),Europe and Eurasia,Bosnia and Herzegovina/Yugoslavia (former),125,Bosnia peace process,Cea,1994-02-26,Intra,Government/territory,Multiparty signed/agreed
479,1637,Agreement on the Demilitarization of the 3km Total Exclusion Zone East of the River Drina,Europe and Eurasia,Bosnia and Herzegovina/Yugoslavia (former),125,Bosnia peace process,Cea,1994-05-21,Intra,Government/territory,Status unclear
480,1639,Meeting of Army Commanders (Military Implementation of COHA),Europe and Eurasia,Bosnia and Herzegovina/Yugoslavia (former),125,Bosnia peace process,Cea,1995-01-11,Intra,Government/territory,Multiparty signed/agreed
481,1641,Principles for Freedom of Movement (COHA implementation),Europe and Eurasia,Bosnia and Herzegovina/Yugoslavia (former),125,Bosnia peace process,Cea,1995-01-31,Intra,Government/territory,Multiparty signed/agreed
482,1642,Agreement for S4 Checkpoint,Europe and Eurasia,Bosnia and Herzegovina/Yugoslavia (former),125,Bosnia peace process,Cea,1995-04-08,Intra,Government/territory,Multiparty signed/agreed
483,1644,Agreement on the disarmament of the able-bodied population in the Zepa enclave,Europe and Eurasia,Bosnia and Herzegovina/Yugoslavia (former),128,Bosnia Local peace processes,Cea,1995-07-24,Intra,Government/territory,Multiparty signed/agreed
484,1645,Declaration (unilateral ceasefire implementation),Europe and Eurasia,Bosnia and Herzegovina/Yugoslavia (former),125,Bosnia peace process,Cea,1995-10-11,Intra,Government/territory,Unilateral document
485,1647,Memorandum of Understanding on the Extension of Monitoring Activities of the Monitor Mission to Yugoslavia,Europe and Eurasia,Croatia/Yugoslavia (former),127,Croatia negotiation process,Imp,1991-09-01,InterIntra,Government/territory,Multiparty signed/agreed
486,1648,Memorandum of Agreement,Europe and Eurasia,Croatia/Yugoslavia (former),127,Croatia negotiation process,Cea,1991-10-08,Intra,Government/territory,Multiparty signed/agreed
487,1650,Decisions on humanitarian convoy to evacuate wounded and sick from Vukovar hospital,Europe and Eurasia,Croatia/Yugoslavia (former),127,Croatia negotiation process,Pre,1991-11-18,Intra,Government/territory,Multiparty signed/agreed
488,1652,Final declaration on the results of the Syria Talks in Vienna as agreed by participants,Middle East and North Africa,Syria,115,Syrian peace process,Pre,2015-10-30,InterIntra,Government,Unilateral document
489,1653,"Agreement on a Cessation of Hostilities between the Government of the Republic of South Sudan and the South Sudan Democratic Movement/Defense Army, Cobra Faction",Africa (excl MENA),South Sudan,151,South Sudan: Post-secession Local agreements,Cea,2014-01-30,IntraLocal,Government,Multiparty signed/agreed
490,1663,Marau Peace Agreement,Asia and Pacific,Solomon Islands,82,Solomon Islands peace process,Imp,2001-02-07,Intra,Inter-group,Multiparty signed/agreed
491,1674,Ceasefire Framework Agreement between the SPLA and Lt. Gen. George Athor’s Forces,Africa (excl MENA),South Sudan,24,South Sudan: Pre-secession Local Peace Processes,Cea,2011-01-05,IntraLocal,Inter-group,Multiparty signed/agreed
492,1675,Agreement on Resolution of the Conflict in Jonglei State between Government of the Republic of South Sudan and South Sudan Democratic Movement/Army-Cobra Faction (SSDM-SSDA-Cobra) (Yau Yau Agreement),Africa (excl MENA),South Sudan,151,South Sudan: Post-secession Local agreements,SubComp,2014-05-09,IntraLocal,Government,Multiparty signed/agreed
493,1677,Agreement to Implement on the Implementation of the cease-fire signed by Interim President Ali Mahdi Mohamed,Africa (excl MENA),Somalia,87,Somalia Peace Process,Cea,1992-03-03,Intra,Government/territory,Unilateral document
494,1678,"Pledge signed at the United Nations Headquarters on 14 February 1992 by Mr Mohamed Qanyare Afah, Head of the delegation of the Interim Government of Somalia",Africa (excl MENA),Somalia,87,Somalia Peace Process,Cea,1992-02-14,Intra,Government/territory,Unilateral document
495,1679,"Pledge signed at the United Nations Headquarters on 14 February 1992 by Mr Osman Hassan Ali, head of the delegation, member of the Standing Committee of the Central Committee of the Somali National Congress ",Africa (excl MENA),Somalia,87,Somalia Peace Process,Cea,1992-02-14,Intra,Government/territory,Unilateral document
496,1682,Declaration of National Commitment (Arwa Declaration) ,Africa (excl MENA),Somalia,87,Somalia Peace Process,SubPar,2000-05-05,Intra,Government/territory,Multiparty signed/agreed
497,1683,Joint Statement of the Heads of State in Tehran,Europe and Eurasia,Armenia/Azerbaijan/(Nagorno-Karabakh),8,Azerbaijan-Nagorno Karabakh: Process,Pre,1992-05-07,InterIntra,Government/territory,Multiparty signed/agreed
498,1684,Agreement on strengthening the ceasefire,Europe and Eurasia,Armenia/Azerbaijan/(Nagorno-Karabakh),8,Azerbaijan-Nagorno Karabakh: Process,Cea,1995-02-04,InterIntra,Government/territory,Multiparty signed/agreed
499,1689,Status of Mission Agreement (SOMA) on the Establishment and Management of the HDC Aceh Monitoring Mission (HAMM),Asia and Pacific,Indonesia/Aceh,55,Indonesia-Aceh peace process,Cea,2002-12-16,Intra,Government/territory,Multiparty signed/agreed
500,1690,Outcome of the Meeting of the Principal Signatory Parties to the Agreement on Planning Implementation of the provisions in Chapter II of the Agreement,Africa (excl MENA),South Sudan,107,South Sudan post-secession process,Imp,2015-11-03,Intra,Government,Multiparty signed/agreed
501,1691,Mundri Agreement,Africa (excl MENA),South Sudan,151,South Sudan: Post-secession Local agreements,SubPar,2015-11-15,IntraLocal,Inter-group,Multiparty signed/agreed
502,1693,Agreement on Ceasefire and the mechanisms of its implementation in Abkhazia,Europe and Eurasia,Georgia/Abkhazia,43,Abkhazia peace process,Cea,1993-09-27,Intra,Government/territory,Multiparty signed/agreed
503,1698,Protocol #36 of Extraordinary Meeting of the Joint Control Commission (JCC) on Georgian-Ossetian Conflict Resolution,Europe and Eurasia,Georgia/Russia/Ossetia,44,South Ossetia peace process,Cea,2004-08-14,Intra,Government/territory,Multiparty signed/agreed
504,1699,Agreement on Principles of Settlement of the Georgian-Ossetian Conflict (Sochi Agreement),Europe and Eurasia,Georgia/Russia/(Ossetia),44,South Ossetia peace process,Cea,1992-06-24,InterIntra,Government/territory,Multiparty signed/agreed
505,1700,Protocol of the Meeting of Representatives of the Parties on the Implementation of the Agreement on Principles of Settlement of the Georgian-Ossetian Conflict,Europe and Eurasia,Georgia/Russia/Ossetia,44,South Ossetia peace process,Cea,1992-07-04,Intra,Government/territory,Multiparty signed/agreed
506,1704,Joint Statement of the Russian Federation and Georgia,Europe and Eurasia,Georgia/Russia/(Abkhazia),43,Abkhazia peace process,Cea,1999-11-17,InterIntra,Government/territory,Multiparty signed/agreed
507,1707,"Protocol of Understanding between the Government of the Republic of Georgia and the Government of the Russian Federation on Economic Restoration of the Regions Located in the Zone of the Georgian-Ossetian Conflict, Signed on 14 September 1993",Europe and Eurasia,Georgia/Russia/(Ossetia),44,South Ossetia peace process,Imp,1994-07-05,InterIntra,Government/territory,Multiparty signed/agreed
508,1713,Agreement on the implementation of the cease-fire signed by Ahmed Farah Aidid,Africa (excl MENA),Somalia,87,Somalia Peace Process,Cea,1992-03-03,Intra,Government/territory,Unilateral document
509,1718,Roadmap agreement,Africa (excl MENA),Sudan/Darfur/Southern Kordofan - Blue Nile - Abyei,21,Darfur-Sudan peace process,Pre,2016-03-21,Intra,Government/territory,Multiparty signed/agreed
510,1719,Ceasefire Agreement between the Government of the Republic of Uganda and the Uganda National Rescue Front II,Africa (excl MENA),Uganda,120,Uganda peace process,Cea,2002-06-15,Intra,Government,Multiparty signed/agreed
511,1720,Toubacouta Communique,Africa (excl MENA),Senegal/Casamance,61,Casamance process,Pre,1991-03-29,Intra,Government/territory,Multiparty signed/agreed
512,1721,Agreement on the Cessation of Shelling of Stepanakert and Agdam,Europe and Eurasia,Armenia/Azerbaijan/Nagorno-Karabakh,8,Azerbaijan-Nagorno Karabakh: Process,Cea,1993-06-17,Intra,Government/territory,Unilateral document
513,1722,Agreement on the Cessation of Hostilities in the Area between Magadiz and Agdam ,Europe and Eurasia,Armenia/Azerbaijan/Nagorno-Karabakh,8,Azerbaijan-Nagorno Karabakh: Process,Cea,1993-06-27,Intra,Government/territory,Multiparty signed/agreed
514,1723,Agreement on a Universal Ceasefire for a Period of 3 Days,Europe and Eurasia,Armenia/Azerbaijan/Nagorno-Karabakh,8,Azerbaijan-Nagorno Karabakh: Process,Cea,1993-07-24,Intra,Government/territory,Unilateral document
515,1724,Agreement on a Universal Ceasefire for a Period of 3 Days,Europe and Eurasia,Armenia/Azerbaijan/Nagorno-Karabakh,8,Azerbaijan-Nagorno Karabakh: Process,Cea,1993-07-25,Intra,Government/territory,Unilateral document
516,1725,Agreement to a Meeting between the Officials of Azerbaijan and Nagorno-Karabakh on 28 July 1993,Europe and Eurasia,Armenia/Azerbaijan/Nagorno-Karabakh,8,Azerbaijan-Nagorno Karabakh: Process,Pre,1993-07-27,Intra,Government/territory,Unilateral document
517,1726,Agreement to Extend the Ceasefire for a Period of 7 Days,Europe and Eurasia,Armenia/Azerbaijan/Nagorno-Karabakh,8,Azerbaijan-Nagorno Karabakh: Process,Cea,1993-07-28,Intra,Government/territory,Multiparty signed/agreed
518,1727,Agreement to Extend the Ceasefire for a Period of 3 Days,Europe and Eurasia,Armenia/Azerbaijan/Nagorno-Karabakh,8,Azerbaijan-Nagorno Karabakh: Process,Cea,1993-08-05,Intra,Government/territory,Multiparty signed/agreed
519,1728,Agreement on the Resumption of the Ceasefire for a Period of 5 Days and a Meeting Between the Leaders of Azerbaijan and Nagorno Karabakh ,Europe and Eurasia,Armenia/Azerbaijan/Nagorno-Karabakh,8,Azerbaijan-Nagorno Karabakh: Process,Cea,1993-08-17,Intra,Government/territory,Unilateral document
520,1729,Agreement on the Resumption of the Ceasefire for a Period of 11 Days and a Meeting between the leaders of Azerbajan and Nagorno-Karabakh,Europe and Eurasia,Armenia/Azerbaijan/Nagorno-Karabakh,8,Azerbaijan-Nagorno Karabakh: Process,Cea,1993-08-30,Intra,Government/territory,Unilateral document
521,1730,Agreement to Extend the Ceasefire for a Period of 3 Days,Europe and Eurasia,Armenia/Azerbaijan/Nagorno-Karabakh,8,Azerbaijan-Nagorno Karabakh: Process,Cea,1993-09-10,Intra,Government/territory,Unilateral document
522,1731,Joint Communique Regarding the Results of the Negotiations between the Representatives of the Azerbaijan and Nagorno-Karabakh Leaderships,Europe and Eurasia,Armenia/Azerbaijan/Nagorno-Karabakh,8,Azerbaijan-Nagorno Karabakh: Process,Pre,1993-09-13,Intra,Government/territory,Multiparty signed/agreed
523,1732,Agreement on the Implementation of the 18 February 1994 Protocol,Europe and Eurasia,Armenia/Azerbaijan/Nagorno-Karabakh,8,Azerbaijan-Nagorno Karabakh: Process,Cea,1994-04-28,Intra,Government/territory,Unilateral document
524,1733,Agreement on Confirmation of Commitment to Ceasefire,Europe and Eurasia,Armenia/Azerbaijan/Nagorno-Karabakh,8,Azerbaijan-Nagorno Karabakh: Process,Cea,1994-07-27,Intra,Government/territory,Multiparty signed/agreed
525,1736,"Agreement on the Bilateral and Final Ceasefire, End of Hostilities, and Surrender of Weapons",Americas,Colombia,101,Colombia V - Santos,Cea,2016-06-23,Intra,Government,Multiparty signed/agreed
526,1751,Agreement Reached between the Government Talks Team comprising Seven Political Parties and the Federal Limbuwan State Council,Asia and Pacific,Nepal,158,Nepal related-local processes,SubPar,2008-03-19,IntraLocal,Government/territory,Multiparty signed/agreed
527,1755,"Agreement between the GoN and Samyukta Janatrantrik Terai Mukti
Morcha",Asia and Pacific,Nepal,158,Nepal related-local processes,Cea,2008-12-26,IntraLocal,Government/territory,Multiparty signed/agreed
528,1756,Agreement between the GoN and Madheshi Virus Killer Party ,Asia and Pacific,Nepal,158,Nepal related-local processes,Cea,2008-12-11,IntraLocal,Government/territory,Multiparty signed/agreed
529,1757,Agreement between the GoN and Terai Samyukta Janakraati Party,Asia and Pacific,Nepal,158,Nepal related-local processes,Cea,2008-12-31,IntraLocal,Government/territory,Multiparty signed/agreed
530,1758,Agreement between the GoN and Janatrantrik Terai Mukti Morcha (Rajan Mukti Samuha),Asia and Pacific,Nepal,158,Nepal related-local processes,Cea,2009-01-10,IntraLocal,Government/territory,Multiparty signed/agreed
531,1759,Agreement between the GoN and Kirant Janawadi Workers Party,Asia and Pacific,Nepal,158,Nepal related-local processes,Cea,2009-01-18,IntraLocal,Government,Multiparty signed/agreed
532,1760,Agreement between the GoN and Liberation Tigers of Terai Eelam (LTTE),Asia and Pacific,Nepal,158,Nepal related-local processes,Cea,2010-02-21,IntraLocal,Government/territory,Multiparty signed/agreed
533,1763,Agreement between the GoN and Madhesh Mukti Tigers,Asia and Pacific,Nepal,158,Nepal related-local processes,Cea,2009-03-20,IntraLocal,Government/territory,Multiparty signed/agreed
534,1773,Protocol of the Gali Meeting between the Georgian and Abkhaz Sides on the Issues of Stablization of the Situation in the Security Zone,Europe and Eurasia,Georgia/Russia/Abkhazia,43,Abkhazia peace process,Cea,2000-07-11,Intra,Government/territory,Multiparty signed/agreed
535,1777,Protocol of the Meeting between the Georgian and Abkhaz Sides on the Issue of Stabilization of the Situation in the Zone of Conflict,Europe and Eurasia,Georgia/Russia/Abkhazia,43,Abkhazia peace process,Cea,2002-01-17,Intra,Government/territory,Multiparty signed/agreed
536,1778,Protocol of the Meeting of Georgian and Abkhaz Sides,Europe and Eurasia,Georgia/Russia/Abkhazia,43,Abkhazia peace process,Cea,2002-02-11,Intra,Government/territory,Multiparty signed/agreed
537,1779,Protocol of the Meeting between the Georgian and Abkhaz Sides,Europe and Eurasia,Georgia/Russia/Abkhazia,43,Abkhazia peace process,Cea,2002-03-29,Intra,Government/territory,Multiparty signed/agreed
538,1782,Protocol of the Third Session of the Coordinating Council of the Goergian and Abkhaz Sides,Europe and Eurasia,Georgia/Russia/Abkhazia,43,Abkhazia peace process,Pre,1998-03-31,Intra,Government/territory,Multiparty signed/agreed
539,1783,Protocol of the Seventh Session of the Coordinating Council of the Georgian and Abkhaz Sides,Europe and Eurasia,Georgia/Russia/Abkhazia,43,Abkhazia peace process,Pre,1999-02-11,Intra,Government/territory,Multiparty signed/agreed
540,1784,Protocol of the Eighth Session of the Coordinating Council of the Georgian and Abkhaz Sides,Europe and Eurasia,Georgia/Russia/Abkhazia,43,Abkhazia peace process,Pre,1999-04-29,Intra,Government/territory,Multiparty signed/agreed
541,1797,Agreement between the GoN and Akhil Terai Mukti Morcha (Sansthapan Paksha),Asia and Pacific,Nepal,158,Nepal related-local processes,Cea,2010-05-07,IntraLocal,Government/territory,Multiparty signed/agreed
542,1800,The Interim National Constitution of the Republic of Sudan 2005,Africa (excl MENA),South Sudan/Sudan,109,Sudanese (North-South) peace process,SubComp,2005-07-06,Intra,Government/territory,Multiparty signed/agreed
543,1804,Minutes of the Cease-fire,Europe and Eurasia,Georgia/Ossetia,44,South Ossetia peace process,Cea,2004-08-13,Intra,Government/territory,Multiparty signed/agreed
544,1812,"Darfur Ceasefire (GoS/SLM/A), Abeche",Africa (excl MENA),South Sudan/Sudan/Darfur,21,Darfur-Sudan peace process,Cea,2003-09-03,Intra,Government/territory,Multiparty signed/agreed
545,1813,Wunlit Dinka Nuer Covenant and Resolutions,Africa (excl MENA),South Sudan,24,South Sudan: Pre-secession Local Peace Processes,SubPar,1999-03-08,IntraLocal,Inter-group,Multiparty signed/agreed
546,1815,Waat Lou Nuer Covenant,Africa (excl MENA),South Sudan,24,South Sudan: Pre-secession Local Peace Processes,SubPar,1999-11-06,IntraLocal,Inter-group,Multiparty signed/agreed
547,1816,"Liliir Covenant between the Anyuak, Dinka, Jie, Kachipo, Murle and Nuer who attended the East Bank People-to-People Peace and Reconciliation Conference in
Liliir, Bor County, Upper Nile, Sudan",Africa (excl MENA),South Sudan,24,South Sudan: Pre-secession Local Peace Processes,SubPar,2000-05-15,IntraLocal,Inter-group,Multiparty signed/agreed
548,1824,"Ceasefire Agreement for the Governorate of al-Hajjah between Ansar Allah and the legitimate Government of Yemen, signed in Dhahran al-Janoub",Middle East and North Africa,Yemen,123,Yemen peace process,Cea,2016-04-02,Intra,Government/territory,Multiparty signed/agreed
549,1825,"Ceasefire Implementation Agreement for the Governorate of Hajjah, signed in Dhahran al-Janoub",Middle East and North Africa,Yemen,123,Yemen peace process,Cea,2016-04-04,Intra,Government/territory,Multiparty signed/agreed
550,1826,Ta'iz Ceasefire Agreement,Middle East and North Africa,Yemen,123,Yemen peace process,Cea,2016-04-16,IntraLocal,Government/territory,Multiparty signed/agreed
551,1829,Chadian Mediator Text of Aichi Agreement,Africa (excl MENA),Sudan,21,Darfur-Sudan peace process,Cea,2008-11-08,Intra,Government/territory,Status unclear
552,1830,Joint Statement between Government of Sudan and Sudanese Liberation Army (SLA),Africa (excl MENA),Sudan,109,Sudanese (North-South) peace process,Cea,2003-11-05,Intra,Government/territory,Multiparty signed/agreed
553,1832,"Joint Communiqué
",Asia and Pacific,India/Nagaland,52,India-Nagaland peace process,Pre,2002-07-11,Intra,Government/territory,Multiparty signed/agreed
554,1835,Extension of Suspension of Operations (SoO) with United People's Front (UPF),Asia and Pacific,India/Manipur,135,India - Manipur,Cea,2015-06-09,Intra,Government/territory,Multiparty signed/agreed
555,1839,NSCN-IM's Announcement of Ceasefire Agreement with Government of India,Asia and Pacific,India/Nagaland,52,India-Nagaland peace process,Cea,1997-07-25,Intra,Government/territory,Unilateral document
556,1840,Arsal 24-Hour Ceasefire Agreement,Middle East and North Africa,Lebanon/Syria,138,Syrian Local Agreements,Cea,2014-08-05,IntraLocal,Government,Multiparty signed/agreed
557,1841,"11-Point Common Position of Ethnic Resistance Organizations on Nationwide Ceasefire (Laiza Agreement)
",Asia and Pacific,Myanmar,80,Myanmar ceasefires process with ethnic armed groups,Cea,2013-11-02,Intra,Government/territory,Multiparty signed/agreed
558,1842,Oslo Joint Statement of 21 February 2011,Asia and Pacific,Philippines,88,Philippines-NDF process,Pre,2011-02-21,Intra,Government,Multiparty signed/agreed
559,1845,Final Agreement to End the Armed Conflict and Build a Stable and Lasting Peace,Americas,Colombia,101,Colombia V - Santos,SubComp,2016-11-24,Intra,Government,Multiparty signed/agreed
560,1846,Conclusions,Europe and Eurasia,Bosnia and Herzegovina/Yugoslavia (former),125,Bosnia peace process,Cea,1992-10-26,Intra,Government/territory,Multiparty signed/agreed
561,1847,Agreement to calm the situation of the ABiH and HVO,Europe and Eurasia,Bosnia and Herzegovina/Yugoslavia (former),125,Bosnia peace process,Cea,1993-05-21,Intra,Government/territory,Multiparty signed/agreed
562,1849,Local Ceasefire Agreement Mostar - Bijela,Europe and Eurasia,Bosnia and Herzegovina/Yugoslavia (former),125,Bosnia peace process,Cea,1993-12-16,Intra,Government/territory,Multiparty signed/agreed
