Index,AgreementId,Name,Region,Country,Peace Process,Peace Process Name,Stage,Signed Date,Agreement/Conflict Level,Conflict Nature,Agreement Status
224,753,Framework Agreement to Resolve the Conflict in Darfur between the Government of Sudan and the LJM,Africa (excl MENA),Sudan/Darfur,21,Darfur-Sudan peace process,SubPar,2010-03-18,Intra,Government/territory,Multiparty signed/agreed
225,754,Ceasefire Agreement between the Government of Sudan and the LJM,Africa (excl MENA),Sudan/Darfur,21,Darfur-Sudan peace process,Cea,2010-03-18,Intra,Government/territory,Multiparty signed/agreed
226,755,Framework Agreement to Resolve the Conflict in Darfur between the Government of Sudan and the JEM,Africa (excl MENA),Sudan/Darfur,21,Darfur-Sudan peace process,SubPar,2010-02-23,Intra,Government/territory,Multiparty signed/agreed
227,757,Cessation of Hostilities Agreement between the Government of the Republic of Uganda and the LRA/M (Addendum 5),Africa (excl MENA),Uganda,120,Uganda peace process,Cea,2008-01-30,Intra,Government,Multiparty signed/agreed
228,759,Accord de Cessez-le-Feu Entre d’une part L’Union des Forces Democratiques pour le Rassemblement (UFDR) et d’autre part la Convention des Patriotes pour la Justice et la Paix (CPJP),Africa (excl MENA),Central African Republic,14,CAR: coups and rebellions process,Cea,2011-10-08,Intra,Government,Multiparty signed/agreed
229,760,Accord de Paix de Birao,Africa (excl MENA),Central African Republic,14,CAR: coups and rebellions process,Cea,2007-04-01,Intra,Government,Multiparty signed/agreed
230,761,"Accord de paix entre le gouvernement du Tchad and les mouvements ci-après: UFDD, RFC, CNT, UFDDF (Accord de Syrte)",Africa (excl MENA),Chad,26,Chad: Fourth War Process,SubPar,2007-10-25,Intra,Government,Multiparty signed/agreed
231,762,Accord de paix entre le gouvernement de la République du Tchad et le Mouvement National (MN),Africa (excl MENA),Chad,26,Chad: Fourth War Process,SubPar,2009-07-25,Intra,Government,Multiparty signed/agreed
232,771,Chin National Front (CNF) and Government 9-point State-level Peace Agreement,Asia and Pacific,Myanmar,80,Myanmar ceasefires process with ethnic armed groups,SubPar,2012-01-06,Intra,Government/territory,Multiparty signed/agreed
233,774,New Mon State Party (NMSP) Government 5-point State-level Peace Agreement between Mon State Level Peace-Making Group ,Asia and Pacific,Myanmar,80,Myanmar ceasefires process with ethnic armed groups,Cea,2012-02-01,Intra,Government/territory,Multiparty signed/agreed
234,776,Rakhine State Liberation Party (RSLP) and State Government Peace-Making Group 5-point State-level Agreement,Asia and Pacific,Myanmar,80,Myanmar ceasefires process with ethnic armed groups,Cea,2012-04-05,Intra,Government/territory,Multiparty signed/agreed
235,786,"General Agreement for the Termination of the Conflict and the Construction of a Stable and Lasting Peace
",Americas,Colombia,101,Colombia V - Santos,Pre,2012-08-26,Intra,Government,Multiparty signed/agreed
236,787,Understanding Regarding Ceasefire in Gaza Strip,Middle East and North Africa,Israel/Palestine,63,Israel-Palestine peace process,Cea,2012-11-21,Intra,Government/territory,Multiparty signed/agreed
237,798,The Peace and National Partnership Agreement,Middle East and North Africa,Yemen,123,Yemen peace process,SubPar,2014-09-21,Intra,Government/territory,Multiparty signed/agreed
238,807,Acte d’Adhésion de la Convention des Patriotes pour la Justice et la Paix (CPJP) à l’Accord de Paix Global de Libreville,Africa (excl MENA),Central African Republic,14,CAR: coups and rebellions process,Imp,2012-08-25,Intra,Government,Multiparty signed/agreed
239,810,Déclaration de principe des parties aux négociations de Libreville sur la crise Centrafricaine,Africa (excl MENA),Central African Republic,14,CAR: coups and rebellions process,Pre,2013-01-11,Intra,Government,Multiparty signed/agreed
240,811,Accord de cessez-le-feu entre le Gouvernement de la République Centrafricaine et la Coalition Seleka,Africa (excl MENA),Central African Republic,14,CAR: coups and rebellions process,Cea,2013-01-11,Intra,Government,Multiparty signed/agreed
241,813,Accord préliminaire à l’élection présidentielle et aux pourparlers inclusifs de paix au Mali (Accord préliminaire de Ouagadougou),Africa (excl MENA),Mali/Azawad,74,Mali-Azawad Inter-Azawad peace process,SubPar,2013-06-18,Intra,Government/territory,Multiparty signed/agreed
242,816,Accord de cessez-le-feu,Africa (excl MENA),Mali/Azawad,74,Mali-Azawad Inter-Azawad peace process,Cea,2014-05-23,Intra,Government/territory,Multiparty signed/agreed
243,818,Accord de cessation des hostilités en République Centrafricaine (Brazzaville Agreement on Cessation of Hostilities),Africa (excl MENA),Central African Republic,14,CAR: coups and rebellions process,Cea,2014-07-23,Intra,Government,Multiparty signed/agreed
244,819,Declaração de Cessação das Hostilidades Militares,Africa (excl MENA),Mozambique,79,Mozambique process - recent,Cea,2014-08-24,Intra,Government,Multiparty signed/agreed
245,825,Agreement between the Transitional Federal Government of Somalia (TFG) and the Alliance for the Re-Liberation of Somalia (ARS) (Djibouti Agreement),Africa (excl MENA),Somalia,87,Somalia Peace Process,Pre,2008-08-18,Intra,Government,Multiparty signed/agreed
246,843,Juba Declaration on Dialogue and National Consensus,Africa (excl MENA),South Sudan/Sudan/Darfur,109,Sudanese (North-South) peace process,Imp,2009-09-30,Intra,Government/territory,Multiparty signed/agreed
247,850,"Terms of Reference for the Abyei Joint Committee
",Africa (excl MENA),South Sudan/Sudan/(Southern Kordofan - Blue Nile - Abyei),111,Kordofan - Blue Nile - Abyei process,Imp,2011-09-08,InterIntra,Government/territory,Multiparty signed/agreed
248,851,Protocol on the Political Participation of the Liberation and Justice Movement (LJM) and Integration of its Forces,Africa (excl MENA),Sudan/Darfur,21,Darfur-Sudan peace process,Imp,2011-07-16,Intra,Government/territory,Multiparty signed/agreed
249,853,"Doha Document for Peace in Darfur (DDPD)
",Africa (excl MENA),Sudan/Darfur,21,Darfur-Sudan peace process,SubComp,2011-05-31,Intra,Government/territory,Multiparty signed/agreed
250,855,Declaration of Cessation of Hostilities and Commitment to the Peace Process between the Government of Sudan and the Justice and Equality Movement Sudan (JEM),Africa (excl MENA),Sudan/Darfur,21,Darfur-Sudan peace process,Cea,2012-10-22,Intra,Government/territory,Multiparty signed/agreed
251,867,Framework Agreement on the Bangsamoro,Asia and Pacific,Philippines/Mindanao,90,Philippines - Mindanao process,SubPar,2012-10-15,Intra,Government/territory,Multiparty signed/agreed
252,870,Guidelines for Mutual Understanding between the CCCH of the GPH and the MILF for Ceasefire-related Functions during the 13 May 2013 National and Local Elections,Asia and Pacific,Philippines/Mindanao,90,Philippines - Mindanao process,Cea,2013-04-22,Intra,Government/territory,Multiparty signed/agreed
253,875,Agreement between the Government of Sudan and the Justice and Equality Movement-Sudan on the Basis of the Doha Document for Peace in Darfur,Africa (excl MENA),Sudan/Darfur,21,Darfur-Sudan peace process,Imp,2013-04-06,Intra,Government/territory,Multiparty signed/agreed
254,876,Protocol on the Participation of JEM-Sudan at the different levels of Government and on the Integration of its Forces,Africa (excl MENA),Sudan/Darfur,21,Darfur-Sudan peace process,Imp,2013-03-29,Intra,Government/territory,Multiparty signed/agreed
255,879,"Agreement between the Government of the Republic of South Sudan (GRSS) and the South Sudan Democratic Movement/Army (SSDM/A)
",Africa (excl MENA),South Sudan,107,South Sudan post-secession process,SubPar,2012-02-27,Intra,Government,Multiparty signed/agreed
256,880,Ceasefire Agreement between the Government of Sudan and the Justice and Equality Movement-Sudan (JEM),Africa (excl MENA),Sudan/Darfur,21,Darfur-Sudan peace process,Cea,2013-02-10,Intra,Government/territory,Multiparty signed/agreed
257,882,"Annex on Normalization to the Framework Agreement on the Bangsamoro (FAB)
",Asia and Pacific,Philippines/Mindanao,90,Philippines - Mindanao process,Imp,2014-01-25,Intra,Government/territory,Multiparty signed/agreed
258,884,"Agreement on Cessation of Hostilities between the Government of the Republic of South Sudan (GRSS) and the Sudan People’s Liberation Movement/Army (In Opposition) (SPLM/A in Opposition)
",Africa (excl MENA),South Sudan,107,South Sudan post-secession process,Cea,2014-01-23,Intra,Government,Multiparty signed/agreed
259,885,Agreement to Resolve the Crisis in South Sudan,Africa (excl MENA),South Sudan,107,South Sudan post-secession process,Cea,2014-05-09,Intra,Government,Multiparty signed/agreed
260,889,Cessation of Hostilities Agreement between the Government of the Republic of Uganda and the LRA/M (Addendum 2),Africa (excl MENA),Uganda,120,Uganda peace process,Cea,2006-12-16,Intra,Government,Multiparty signed/agreed
261,890,Cessation of Hostilities Agreement between the Government of the Republic of Uganda and the LRA/M (Addendum 1),Africa (excl MENA),Uganda,120,Uganda peace process,Cea,2006-11-01,Intra,Government,Multiparty signed/agreed
262,891,Cessation of Hostilities Agreement between the Government of the Republic of Uganda and the LRA/M (Addendum 3),Africa (excl MENA),Uganda,120,Uganda peace process,Cea,2007-04-14,Intra,Government,Multiparty signed/agreed
263,892,Cessation of Hostilities Agreement between the Government of the Republic of Uganda and the LRA/M (Addendum 4),Africa (excl MENA),Uganda,120,Uganda peace process,Cea,2007-11-03,Intra,Government,Multiparty signed/agreed
264,907,Declaration by the Leaders of the Somali Political Organisations,Africa (excl MENA),Somalia,87,Somalia Peace Process,Pre,1994-03-24,Intra,Government,Multiparty signed/agreed
265,910,Peace Agreement between the Government of the Republic of Chad and the Movement for Democracy and justice in Chad (MDJT) (Tripoli Agreement),Africa (excl MENA),Chad,22,Chad: 'third war' process,SubPar,2002-01-07,Intra,Government,Multiparty signed/agreed
266,913,Agreement between the Government of the Republic of Sudan and the Sudan People's Liberation Movement to Protect Non-Combatant Civilians and Civilian Facilities from Military Attack,Africa (excl MENA),South Sudan/Sudan,109,Sudanese (North-South) peace process,SubPar,2002-03-31,Intra,Government/territory,Multiparty signed/agreed
267,915,Agreement on Complete Cessation of Hostilities,Europe and Eurasia,Bosnia and Herzegovina/Yugoslavia (former),125,Bosnia peace process,Cea,1994-12-31,Intra,Government/territory,Multiparty signed/agreed
268,916,"Comprehensive Ceasefire Agreement, Pleso",Europe and Eurasia,Bosnia and Herzegovina/Yugoslavia (former),125,Bosnia peace process,Cea,1994-12-23,Intra,Government/territory,Multiparty signed/agreed
269,918,The IGAD Declaration of Principles,Africa (excl MENA),South Sudan/Sudan,109,Sudanese (North-South) peace process,SubPar,1994-05-20,Intra,Government/territory,Multiparty signed/agreed
270,932,Additional Implementing Rules of the Joint Agreement on Safety and Immunity Guarantees (JASIG) Pertaining to the Security of Personnel and Consultations in Furtherance of the Peace Negotiations,Asia and Pacific,Philippines,88,Philippines-NDF process,Imp,1998-03-16,Intra,Government,Multiparty signed/agreed
271,944,Joint Press Release,Asia and Pacific,Philippines/Mindanao,90,Philippines - Mindanao process,Pre,1997-01-07,Intra,Government/territory,Multiparty signed/agreed
272,945,Administrative Procedures in the Conduct of GRP-MILF Technical Committee Meetings,Asia and Pacific,Philippines/Mindanao,90,Philippines - Mindanao process,Pre,1997-02-26,Intra,Government/territory,Multiparty signed/agreed
273,946,Resolution No. 1 Composition of the Interim Ceasefire Monitoring Committee and Assigned Tasks and Functions,Asia and Pacific,Philippines/Mindanao,90,Philippines - Mindanao process,Cea,1997-03-25,Intra,Government/territory,Multiparty signed/agreed
274,947,Joint Press Statement,Asia and Pacific,Philippines/Mindanao,90,Philippines - Mindanao process,Pre,1997-03-25,Intra,Government/territory,Multiparty signed/agreed
275,948,Joint Press Statement,Asia and Pacific,Philippines/Mindanao,90,Philippines - Mindanao process,Pre,1997-09-02,Intra,Government/territory,Multiparty signed/agreed
276,949,GRP and MILF Joint Press Release,Asia and Pacific,Philippines/Mindanao,90,Philippines - Mindanao process,Pre,1997-10-21,Intra,Government/territory,Multiparty signed/agreed
277,950,Joint Press Statement,Asia and Pacific,Philippines/Mindanao,90,Philippines - Mindanao process,Pre,1998-02-07,Intra,Government/territory,Multiparty signed/agreed
278,952,Joint Statement by the GRP-MILF Technical Committee,Asia and Pacific,Philippines/Mindanao,90,Philippines - Mindanao process,Pre,1998-09-18,Intra,Government/territory,Multiparty signed/agreed
279,953,Joint Statement,Asia and Pacific,Philippines/Mindanao,90,Philippines - Mindanao process,Pre,1999-02-17,Intra,Government/territory,Multiparty signed/agreed
280,954,Joint Statement of the GRP and MILF Technical Committees,Asia and Pacific,Philippines/Mindanao,90,Philippines - Mindanao process,Pre,1999-09-15,Intra,Government/territory,Multiparty signed/agreed
281,955,Second Joint Acknowledgment of MILF Camps,Asia and Pacific,Philippines/Mindanao,90,Philippines - Mindanao process,Pre,1999-10-06,Intra,Government/territory,Multiparty signed/agreed
282,959,Joint Communique,Asia and Pacific,Philippines/Mindanao,90,Philippines - Mindanao process,Pre,2000-01-20,Intra,Government/territory,Multiparty signed/agreed
283,961,Joint Press Statement,Asia and Pacific,Philippines/Mindanao,90,Philippines - Mindanao process,Pre,2000-02-15,Intra,Government/territory,Multiparty signed/agreed
284,962,Joint Communique,Asia and Pacific,Philippines/Mindanao,90,Philippines - Mindanao process,Pre,2000-02-23,Intra,Government/territory,Multiparty signed/agreed
285,963,Joint Communique,Asia and Pacific,Philippines/Mindanao,90,Philippines - Mindanao process,Pre,2000-03-02,Intra,Government/territory,Multiparty signed/agreed
286,966,Aide Memoire: Highlights of the Special Meeting of the GRP and MILF Peace Panels,Asia and Pacific,Philippines/Mindanao,90,Philippines - Mindanao process,Pre,2000-04-27,Intra,Government/territory,Multiparty signed/agreed
287,972,Interim Implementing Guidelines on the Joint Communique of 6 May 2002,Asia and Pacific,Philippines/Mindanao,90,Philippines - Mindanao process,Ren,2004-12-21,Intra,Government/territory,Multiparty signed/agreed
288,973,Joint Statement - 6th GRP-MILF Exploratory Talks (December 21 2004),Asia and Pacific,Philippines/Mindanao,90,Philippines - Mindanao process,Pre,2004-12-21,Intra,Government/territory,Multiparty signed/agreed
289,974,Joint Statement -7th GRP-MILF Exploratory Talks (April 20 2005),Asia and Pacific,Philippines/Mindanao,90,Philippines - Mindanao process,Pre,2005-04-20,Intra,Government/territory,Multiparty signed/agreed
290,978,Luena Memorandum of Understanding (Addendum to the Lusaka Protocol for the Cessation of Hostilities and the Resolution of the Outstanding Military Issues under the Lusaka Protocol),Africa (excl MENA),Angola,4,Angola: UNITA process,SubPar,2002-04-04,Intra,Government,Multiparty signed/agreed
291,990,Ceasefire Agreement Signed in Bishkek,Europe and Eurasia,Armenia/Azerbaijan/Nagorno-Karabakh,8,Azerbaijan-Nagorno Karabakh: Process,Cea,1994-05-11,Intra,Government/territory,Multiparty signed/agreed
292,995,Joint Statement - 12th GRP-MILF Exploratory Talks,Asia and Pacific,Philippines/Mindanao,90,Philippines - Mindanao process,Pre,2006-05-04,Intra,Government/territory,Multiparty signed/agreed
293,996,Joint Statement - Special Meeting (August 27 2007),Asia and Pacific,Philippines/Mindanao,90,Philippines - Mindanao process,Pre,2007-08-27,Intra,Government/territory,Multiparty signed/agreed
294,1010,The LTTE's Proposal for an Agreement to Establish an Interim Self-Governing Authority for the Northeast,Asia and Pacific,Sri Lanka,114,Sri Lanka LTTE 2002 onward process,Pre,2003-10-31,Intra,Government/territory,Unilateral document
295,1012,Memorandum of Understanding for the Establishment of a Post-Tsunami Operational Management Structure (P-TOMS),Asia and Pacific,Sri Lanka,114,Sri Lanka LTTE 2002 onward process,SubPar,2005-06-27,Intra,Government/territory,Multiparty signed/agreed
296,1019,Implementing Accord,Europe and Eurasia,Croatia/Yugoslavia (former),127,Croatia negotiation process,Cea,1992-01-02,Intra,Government/territory,Multiparty signed/agreed
297,1022,Agreement of 5 June 1992 on the reopening of the Sarajevo Airport for humanitarian purposes,Europe and Eurasia,Bosnia and Herzegovina/Yugoslavia (former),125,Bosnia peace process,Pre,1992-06-05,Intra,Government/territory,Multiparty signed/agreed
298,1024,Agreement on the Principles for a Peaceful Settlement of the Armed Conflict in the Dniester Region of the Republic of Moldova,Europe and Eurasia,Moldova/Russia/(Transdniestria),76,Moldova Transdniestria process,Cea,1992-07-21,InterIntra,Government/territory,Multiparty signed/agreed
299,1025,Protocol of Consultations on the Regulation of the Conflict between Georgia and Abkhazia,Europe and Eurasia,Georgia/Abkhazia,43,Abkhazia peace process,Cea,1992-08-28,Intra,Government/territory,Multiparty signed/agreed
300,1026,Protocol of Negotiations between the Governmental Delegations of the Republic of Georgia and the Russian Federation,Europe and Eurasia,Georgia/Russia/(Abkhazia),43,Abkhazia peace process,Pre,1993-04-09,InterIntra,Government/territory,Multiparty signed/agreed
301,1027,Agreement for the Demilitarization of Srebrenica,Europe and Eurasia,Bosnia and Herzegovina/Yugoslavia (former),125,Bosnia peace process,Cea,1993-04-18,Intra,Government/territory,Multiparty signed/agreed
302,1029,Agreement on Further Development of Georgian-Ossetian Peaceful Settlement Process and on Joint Control Commission,Europe and Eurasia,Georgia/Russia/Ossetia,44,South Ossetia peace process,Imp,1994-10-31,Intra,Government/territory,Multiparty signed/agreed
303,1030,Conclusions of the Peace Implementation Conference held at Lancaster House (London Conference),Europe and Eurasia,Bosnia and Herzegovina/Yugoslavia (former),125,Bosnia peace process,Pre,1995-12-09,InterIntra,Government/territory,Multiparty signed/agreed
304,1034,Acuerdo para la Liberación de los Delegados de la OEA / Agreement for the Liberation of detained OAS Delegates,Americas,Colombia,98,Colombia II - Samper,SubPar,1997-11-01,Intra,Government,Multiparty signed/agreed
305,1040,Memorandum of Understanding between the Government of Guinea Bissau and the Self-proclaimed Military Junta,Africa (excl MENA),Guinea-Bissau,46,Guinea Bissau peace process,Pre,1998-07-26,Intra,Government,Multiparty signed/agreed
306,1041,"Agreement on Cessation of Hostilities and Peaceful Settlement of Conflict between the Armed Forces of Liberia, and The National Patriotic Front of Liberia, and the Independent National Patriotic Front of Liberia (Lome Ceasefire Agreement)",Africa (excl MENA),Liberia,69,Liberia peace process,Cea,1991-02-13,Intra,Government,Multiparty signed/agreed
307,1046,Accords de Paix et de cessation des hostilités dans le département de Pool,Africa (excl MENA),Republic of Congo,92,Republic of Congo peace process,Cea,2003-03-17,Intra,Government,Multiparty signed/agreed
308,1047,Agreed Ground Rules for Suspension of Operations between the Security Forces and the Bodo Liberation Tigers (BLT),Asia and Pacific,India/Bodoland,50,India Bodoland peace process,Pre,2000-03-29,Intra,Government/territory,Multiparty signed/agreed
309,1049,Extension of Ceasefire with the NSCN-IM,Asia and Pacific,India/Nagaland,52,India-Nagaland peace process,Cea,2001-06-14,Intra,Government/territory,Multiparty signed/agreed
310,1050,Communiqué on the Cessation of Hostilities between the Civil Defense Force (CDF) and the Revolutionary United Front (RUF),Africa (excl MENA),Sierra Leone,71,Sierra Leone peace process,Cea,2001-05-15,Intra,Government,Multiparty signed/agreed
311,1051,Peace Agreement between the Republic of the Philippines and the Rebolusyonaryong Partido NG Manggagawa – Pilipinas/Revolutionary Proletarian Army/Alex Boncayao Brigade,Asia and Pacific,Philippines/Rebolusyonaryong Partido ng Manggagawa-Pilipineas (RPMP/RPA/ABB),91,RAM process,Pre,2000-12-06,Intra,Government,Multiparty signed/agreed
312,1052,Rules and Procedures to Implement the Intent and Provisions of the Peace Agreement between the Republic of the Philippines and the Rebolusyonaryong Partido NG Manggagawa – Pilipinas/Revolutionary Proletarian Army/Alex Boncayao Brigade,Asia and Pacific,Philippines/Rebolusyonaryong Partido ng Manggagawa-Pilipineas (RPMP/RPA/ABB),91,RAM process,Imp,2002-10-14,Intra,Government,Multiparty signed/agreed
313,1053,"Ceasefire Agreement between the Government of Côte d'Ivoire, the Mouvement Populaire Ivoirien du Grand Ouest (MPIGO) and the Mouvement pour la Justice et la Paix (MSP)",Africa (excl MENA),Cote d'Ivoire,5,Cote D'Ivoire: peace process,Cea,2003-01-13,Intra,Government,Multiparty signed/agreed
314,1056,Protocol of the Gali Meeting on Security Matters,Europe and Eurasia,Georgia/Abkhazia,43,Abkhazia peace process,Imp,2004-01-19,Intra,Government/territory,Multiparty signed/agreed
315,1057,Joint Statement of the Government of India and the NSCN-IM,Asia and Pacific,India/Nagaland,52,India-Nagaland peace process,Pre,2004-07-30,Intra,Government/territory,Multiparty signed/agreed
316,1063,Agreement reached between the Government of Nepal and the CPN (Maoists) at Kupodole,Asia and Pacific,Nepal,81,Nepal peace process,Imp,2006-06-15,Intra,Government,Multiparty signed/agreed
317,1065,Declaration of Commitment to the Darfur Peace Agreement,Africa (excl MENA),Sudan/Darfur,21,Darfur-Sudan peace process,Ren,2006-06-08,Intra,Government/territory,Multiparty signed/agreed
318,1067,Juba Declaration on Unity and Integration between the Sudan People’s Liberation Army (SPLA) and the South Sudan Defence Forces (SSDF),Africa (excl MENA),South Sudan,107,South Sudan post-secession process,Imp,2006-01-08,Intra,Government,Multiparty signed/agreed
319,1077,Agreement between Sudan and South Sudan on security arrangements,Africa (excl MENA),South Sudan/Sudan,110,North - South Sudan secession process,SubPar,2012-09-27,InterIntra,Territory,Multiparty signed/agreed
320,1080,The United Western Somali Liberation Front (UWSLF) on the Termination of the State of Insurgency,Africa (excl MENA),Ethiopia/Ogaden,40,Ogaden peace process,SubPar,2010-07-29,Intra,Government/territory,Multiparty signed/agreed
321,1097,"Acuerdo entre el Gobierno Nacional y el Movimiento Armado Quintín Lame, Cauca",Americas,Colombia,97,Colombia I - Gaviria,Pre,1990-09-14,Intra,Government,Multiparty signed/agreed
322,1100,"Comunicado Gobierno-CGSB, Finalización de la Primera Ronda de Conversaciones, Caracas",Americas,Colombia,97,Colombia I - Gaviria,Pre,1991-06-15,Intra,Government,Multiparty signed/agreed
323,1101,"Acuerdo sobre Veedurías, Segunda Ronda de Conversaciones Gobierno-CGSB, Caracas",Americas,Colombia,97,Colombia I - Gaviria,Pre,1991-06-25,Intra,Government,Multiparty signed/agreed
324,1102,"Comunicado Conjunto, Gobierno-CGSB: Acuerdo de Garantías para Traslados de la Comisión Negociadora CGSB, Santafé de Bogotá-Caracas",Americas,Colombia,97,Colombia I - Gaviria,Ren,1991-07-19,Intra,Government,Multiparty signed/agreed
325,1104,"Acta de Resumen, Reuniones entre el Gobierno de Colombia y la CGSB",Americas,Colombia,97,Colombia I - Gaviria,Pre,1991-11-10,Intra,Government,Multiparty signed/agreed
326,1106,"Comunicado de las Comisiones Negociadoras del Gobierno y la CGSB, Reinicio del Diálogo en México",Americas,Colombia,97,Colombia I - Gaviria,Ren,1992-03-03,Intra,Government,Multiparty signed/agreed
327,1107,"Comunicado, Comisiones Negociadoras del Gobierno y la CGSB, Agenda de Temas.",Americas,Colombia,97,Colombia I - Gaviria,Pre,1992-03-13,Intra,Government,Multiparty signed/agreed
328,1108,"Declaración Conjunta, Comisión de Paz de la Cámara y CGSB, Tlaxcala",Americas,Colombia,97,Colombia I - Gaviria,Pre,1992-03-18,Intra,Government,Multiparty signed/agreed
329,1132,"Declaración de Tregua Unilateral Durante Temporada de Fin den Ano, FARC-EP",Americas,Colombia,99,Colombia III - Arango,Cea,1999-12-20,Intra,Government,Multiparty signed/agreed
330,1136,"Intercambio de Propuestas sobre el Cese al Fuego, Comunicado No. 19, Mesa Nacional de Diálogos y Negociación",Americas,Colombia,99,Colombia III - Arango,Pre,2000-07-03,Intra,Government,Multiparty signed/agreed
331,1137,"Respaldo de las Fuerzas Políticas al Proceso de Paz, Comunicado No.21",Americas,Colombia,99,Colombia III - Arango,Pre,2000-08-03,Intra,Government,Multiparty signed/agreed
332,1145,"Acta de Acuerdo: Reunión Preparatoria Para la Convención Nacional, Gobierno Nacional-ELN",Americas,Colombia,99,Colombia III - Arango,Pre,1998-10-08,Intra,Government,Multiparty signed/agreed
333,1151,"Declaración de la Habana, Gobierno Nacional-ELN",Americas,Colombia,99,Colombia III - Arango,Pre,2001-12-15,Intra,Government,Multiparty signed/agreed
334,1154,Tokyo Declaration on Reconstruction and Development of Sri Lanka,Asia and Pacific,Sri Lanka,114,Sri Lanka LTTE 2002 onward process,Imp,2003-06-10,InterIntra,Government/territory,Multiparty signed/agreed
335,1157,Statement read out by the Norwegian Facilitator Erik Solheim,Asia and Pacific,Sri Lanka,114,Sri Lanka LTTE 2002 onward process,Ren,2006-02-24,Intra,Government/territory,Multiparty signed/agreed
336,1158,Agreed Measures to Improve the Security Situation in the East,Asia and Pacific,Sri Lanka,114,Sri Lanka LTTE 2002 onward process,Cea,2002-11-01,Intra,Government/territory,Multiparty signed/agreed
