Index,AgreementId,Name,Region,Country,Peace Process,Peace Process Name,Stage,Signed Date,Agreement/Conflict Level,Conflict Nature,Agreement Status
1,9,Rules Governing the Work of the Working Groups,Europe and Eurasia,Georgia/Abkhazia,43,Abkhazia peace process,Pre,1997-06-12,Intra,Government/territory,Multiparty signed/agreed
2,10,Final Document of the Moscow Meeting (Moscow Ceasefire),Europe and Eurasia,Georgia/Russia/Abkhazia,43,Abkhazia peace process,Cea,1992-09-03,Intra,Government/territory,Multiparty signed/agreed
3,12,Memorandum of understanding between the Georgian and Abkhaz sides at the negotiations held in Geneva,Europe and Eurasia,Georgia/Abkhazia,43,Abkhazia peace process,SubPar,1993-12-01,Intra,Territory,Multiparty signed/agreed
4,17,Record of the first extraordinary session of the Coordinating Council of the Georgian and Abkhaz parties,Europe and Eurasia,Georgia/Abkhazia,43,Abkhazia peace process,Pre,1998-01-22,Intra,Government/territory,Multiparty signed/agreed
5,19,Protocol of the fourth (second special) session of the Coordinating Council of the Georgian and Abkhaz sides,Europe and Eurasia,Georgia/Abkhazia,43,Abkhazia peace process,Pre,1998-05-22,Intra,Government/territory,Multiparty signed/agreed
6,20,"Protocol on the ceasefire, separation of armed formations and guarantees on the inadmissibility of forcible activities ('Gagra Protocol')",Europe and Eurasia,Georgia/Abkhazia,43,Abkhazia peace process,Cea,1998-05-25,Intra,Government/territory,Multiparty signed/agreed
7,21,"Concluding statement on the results of the second meeting of the Georgian and Abkhaz sides, Geneva, 23-25 July 1998.",Europe and Eurasia,Georgia/Abkhazia,43,Abkhazia peace process,Pre,1998-07-25,Intra,Government/territory,Multiparty signed/agreed
8,22,Protocol of the fifth session of the Coordinating Council of the Georgian and Abkhaz sides,Europe and Eurasia,Georgia/Abkhazia,43,Abkhazia peace process,Cea,1998-09-02,Intra,Government/territory,Multiparty signed/agreed
9,23,Minutes of the meeting between the Georgian and Abkhaz sides on stabilization of the situation along the line separating the sides,Europe and Eurasia,Georgia/Abkhazia,43,Abkhazia peace process,Pre,1998-09-24,Intra,Government/territory,Multiparty signed/agreed
10,24,Protocol of the sixth session of the Coordinating Council of the Georgian and Abkhaz sides,Europe and Eurasia,Georgia/Abkhazia,43,Abkhazia peace process,Pre,1998-12-18,Intra,Government/territory,Multiparty signed/agreed
11,25,Protocol of the Meeting of Georgian and Abkhaz Sides,Europe and Eurasia,Georgia/Abkhazia,43,Abkhazia peace process,Cea,1998-12-21,Intra,Government/territory,Multiparty signed/agreed
12,38,Outcome of Deliberations of the Meeting held in Yamoussokro on 29 and 30 June 1991 (Yamoussoukro I Accord),Africa (excl MENA),Liberia,69,Liberia peace process,Cea,1991-06-30,Intra,Government,Multiparty signed/agreed
13,39,"Final Communique of the First Meeting of the Committee of Five on Liberia, Yamoussoukro (Yamoussoukro II Accord)",Africa (excl MENA),Liberia,69,Liberia peace process,Pre,1991-07-29,InterIntra,Government,Multiparty signed/agreed
14,40,"Final Communique of the Second Meeting of Five on the Liberian Crises , Yamoussokro (Yamoussoukro III Accord)",Africa (excl MENA),Liberia,69,Liberia peace process,SubPar,1991-09-17,InterIntra,Government,Multiparty signed/agreed
15,46,Protocol on Detailed Agenda,Africa (excl MENA),Mozambique,78,Mozambique process in the 90s,Pre,1991-05-28,Intra,Government,Multiparty signed/agreed
16,62,Statement by the Government of Sierra Leone and the Revolutionary United Front of Sierra Leone on the Release of Prisoners of War and Non-combatants,Africa (excl MENA),Sierra Leone,71,Sierra Leone peace process,Imp,1999-06-02,Intra,Government,Multiparty signed/agreed
17,63,Statement by the Government of Sierra Leone and the Revolutionary United Front of Sierra Leone on the Delivery of Humanitarian Assistance in Sierra Leone,Africa (excl MENA),Sierra Leone,71,Sierra Leone peace process,Imp,1999-06-03,Intra,Government,Multiparty signed/agreed
18,79,Final Communique of the Lome Meeting on the Peace Process in Guinea-Bissau,Africa (excl MENA),Guinea-Bissau,46,Guinea Bissau peace process,Imp,1998-12-15,Intra,Government,Multiparty signed/agreed
19,80,Townsville Peace Agreement,Asia and Pacific,Solomon Islands,82,Solomon Islands peace process,SubPar,2000-10-15,Intra,Inter-group,Multiparty signed/agreed
20,85,25-Point Ceasefire Code of Conduct Agreed between the Government of Nepal and SPN (Maoist),Asia and Pacific,Nepal,81,Nepal peace process,Cea,2006-05-25,Intra,Government,Multiparty signed/agreed
21,86,Agreement of the Third Round Negotiations between the Government of Nepal and CPN (Maoists) at the Prime Minister's Baluwatar and 8-Point Agreement,Asia and Pacific,Nepal,81,Nepal peace process,Pre,2006-06-16,Intra,Government,Multiparty signed/agreed
22,88,Agreement on the Monitoring of Arms and Armies,Asia and Pacific,Nepal,81,Nepal peace process,Imp,2006-12-08,Intra,Government,Multiparty signed/agreed
23,89,"Understanding on Interim Task Force (documented in identical letters from the   dated 9 August 2006 from the Chairman of the Communist
Party of Nepal (Maoist) and the Prime Minister of Nepal to the UN Secretary-General)",Asia and Pacific,Nepal,81,Nepal peace process,Pre,2006-11-22,Intra,Government,Multiparty signed/agreed
24,90,"Protocol between the Government of the Sudan (GoS), The Sudan Liberation movement/Army (SLM/A) and the Justice and Equality Movement (JEM) on the Enhancement of the Security Situation in Darfur in Accordance with the N'Djamena Agreement",Africa (excl MENA),Sudan/Darfur,21,Darfur-Sudan peace process,Ren,2004-11-09,Intra,Government/territory,Multiparty signed/agreed
25,91,"Protocol between the Government of Sudan, SLM/A and the JEM on the Improvement of the Humanitarian Situation in Darfur",Africa (excl MENA),Sudan/Darfur,21,Darfur-Sudan peace process,Imp,2004-11-09,Intra,Government/territory,Multiparty signed/agreed
26,92,"Agreement with the Sudanese Parties on the Modalities for the Establishment of the Ceasefire Commission and the Deployment of Observers in the Darfur, Addis Ababa Agreement",Africa (excl MENA),Sudan/Darfur,21,Darfur-Sudan peace process,Cea,2004-05-28,Intra,Government/territory,Multiparty signed/agreed
27,101,Points for Further Consultation,Asia and Pacific,Indonesia/Aceh,55,Indonesia-Aceh peace process,Pre,2002-02-03,Intra,Government/territory,Multiparty signed/agreed
28,103,Evaluation of the Conduct of Cessation of Violence,Asia and Pacific,Indonesia/Aceh,55,Indonesia-Aceh peace process,Cea,2001-04-04,Intra,Government/territory,Multiparty signed/agreed
29,104,4th Commander to Commander Agreement: The Follow-Up of Security Arrangements in Aceh,Asia and Pacific,Indonesia/Aceh,55,Indonesia-Aceh peace process,Cea,2001-03-18,Intra,Government/territory,Multiparty signed/agreed
30,105,3rd Commander to Commander Agreement: The Third Term Evaluation Results of the Cessation of Violence in Aceh,Asia and Pacific,Indonesia/Aceh,55,Indonesia-Aceh peace process,Cea,2001-03-01,Intra,Government/territory,Multiparty signed/agreed
31,106,2nd Commander to Commander Agreement: Results of 10-day Evaluation Concerning Agreement Implementation on Cessation of Violence in Aceh,Asia and Pacific,Indonesia/Aceh,55,Indonesia-Aceh peace process,Cea,2001-02-22,Intra,Government/territory,Multiparty signed/agreed
32,108,Agreement Reached by both Field Commanders of the RI and the GAM,Asia and Pacific,Indonesia/Aceh,55,Indonesia-Aceh peace process,Cea,2001-02-10,Intra,Government/territory,Multiparty signed/agreed
33,113,Joint Understanding on Humanitarian Pause for Aceh,Asia and Pacific,Indonesia/Aceh,55,Indonesia-Aceh peace process,Cea,2000-05-12,Intra,Government/territory,Multiparty signed/agreed
34,136,Mitchell Report,Europe and Eurasia,Ireland/United Kingdom/Northern Ireland,62,Northern Ireland peace process,Pre,1996-01-22,Intra,Government/territory,Unilateral document
35,154,Acuerdo de San Francisco de la Sombra para Concretar y Consolidar el Proceso de Paz,Americas,Colombia,99,Colombia III - Arango,Pre,2001-10-05,Intra,Government,Multiparty signed/agreed
36,156,Acuerdo de la Puerta del Cielo,Americas,Colombia,98,Colombia II - Samper,Pre,1998-07-15,Intra,Government,Multiparty signed/agreed
37,157,Acuerdo de Cronograma de Consenso para el Futuro del Proceso de Paz,Americas,Colombia,99,Colombia III - Arango,Pre,2002-01-20,Intra,Government,Multiparty signed/agreed
38,159,Acuerdo por Colombia entre el Gobierno Colombiano y el Ejército de Liberación Nacional (ELN): Reiniciar el Diálogo con uns Agenda de Transición,Americas,Colombia,99,Colombia III - Arango,Pre,2001-11-24,Intra,Government,Multiparty signed/agreed
39,166,"Declaración del Gobierno y la CGSB, Primera Ronda de Conversaciones (The Caracas Agenda)",Americas,Colombia,97,Colombia I - Gaviria,Pre,1991-06-06,Intra,Government,Multiparty signed/agreed
40,185,Agreement between the Government of Guinea Bissau and the Self-proclaimed military junta ('Abuja Accord'),Africa (excl MENA),Guinea-Bissau,46,Guinea Bissau peace process,SubPar,1998-11-01,Intra,Government,Multiparty signed/agreed
41,187,1993 Interim Ceasefire Agreement Between the Government of the Republic of The Philippines (GRP) and the Moro National Liberation Front (MNLF) with the Participation of the Organization of the Islamic Conference (OIC),Asia and Pacific,Philippines/Mindanao,90,Philippines - Mindanao process,Cea,1993-11-07,Intra,Government/territory,Multiparty signed/agreed
42,189,Joint Acknowledgement of Two MILF Camps,Asia and Pacific,Philippines/Mindanao,90,Philippines - Mindanao process,Pre,1999-02-10,Intra,Government/territory,Multiparty signed/agreed
43,192,A Performance Based Roadmap to a Permanent Two-State Solution to the Israeli-Palestinian Conflict,Middle East and North Africa,Israel/Palestine,63,Israel-Palestine peace process,Pre,2003-04-30,Intra,Government/territory,Unilateral document
44,194,"Abuja Peace Agreement to Supplement the Cotonou and Akosombo
Agreements as subsequently clarified by the Accra Agreement",Africa (excl MENA),Liberia,69,Liberia peace process,Imp,1995-08-19,Intra,Government,Multiparty signed/agreed
45,197,Accord cadre de réforme et de concorde civile,Africa (excl MENA),Djibouti,20,Djibouti: FRUD process,SubComp,2000-02-07,Intra,Government/territory,Multiparty signed/agreed
46,198,Agreement on Ending Hostilities in the Republic of Congo,Africa (excl MENA),Republic of Congo,92,Republic of Congo peace process,Cea,1999-11-16,Intra,Government,Multiparty signed/agreed
47,199,Accord de Cessation des Hostilités,Africa (excl MENA),Cote d'Ivoire,5,Cote D'Ivoire: peace process,Cea,2002-10-17,Intra,Government,Multiparty signed/agreed
48,200,Accord de Cessez-le-Feu,Africa (excl MENA),Cote d'Ivoire,5,Cote D'Ivoire: peace process,Cea,2003-05-03,Intra,Government,Multiparty signed/agreed
49,201,Ceasefire and ending hostilities agreement between the High Command of the Security Forces and the High Command of the Self-defence Forces of Resistance (FADR),Africa (excl MENA),Republic of Congo,92,Republic of Congo peace process,Cea,1999-12-29,Intra,Government,Multiparty signed/agreed
50,203,Accord de Paix entre le Gouvernement de la Republique du Niger et la Coordination de la Resistance Armee (Ouagadougou Accord),Africa (excl MENA),Niger/Air and Azawad,83,Niger peace process,SubPar,1994-10-09,Intra,Government/territory,Multiparty signed/agreed
51,204,Accord établissant une paix définitive entre le Gouvernement de la République du Niger et l'Organisation de la Résistance Armée,Africa (excl MENA),Niger/Air and Azawad,83,Niger peace process,SubComp,1995-04-15,Intra,Government/territory,Multiparty signed/agreed
52,206,"Accord sur la cessation des hostilities entre le Gouvernement de la Republique du Mali d'une part, et le Mouvement Populaire de l'Azaouad et le Front Islamique Arabe d'autre part (Accords de Tamanrasset)",Africa (excl MENA),Mali/Azawad,74,Mali-Azawad Inter-Azawad peace process,Cea,1991-01-06,Intra,Government/territory,Multiparty signed/agreed
53,207,"Peace Accords for Angola, Lisbon ('Bicesse Accords')",Africa (excl MENA),Angola,4,Angola: UNITA process,SubPar,1991-05-31,Intra,Government,Multiparty signed/agreed
54,209,Accra Acceptance and Accession Agreement,Africa (excl MENA),Liberia,69,Liberia peace process,Imp,1994-12-21,Intra,Government,Multiparty signed/agreed
55,216,Addis Ababa Agreement concluded at the first session of the Conference on National Reconciliation in Somalia,Africa (excl MENA),Somalia,87,Somalia Peace Process,SubComp,1993-03-27,Intra,Government,Multiparty signed/agreed
56,221,Agreement between the Government of the State of Eritrea and the Government of the Federal Democratic Republic of Ethiopia (Algiers Agreement),Africa (excl MENA),Eritrea/Ethiopia,37,Eritrea-Ethiopia border dispute peace process,SubPar,2000-12-12,Inter,Territory,Multiparty signed/agreed
57,227,"Agreement ""On Urgent Measures to Stop Fire and Combat Operations in the City of Grozny and on the Territory of Chechnya""",Europe and Eurasia,Russia/Chechnya,93,Chechnya peace process,Cea,1996-08-22,Intra,Government/territory,Multiparty signed/agreed
58,239,"Agreement between the President of the Republic of Tajikistan, E.S. Rakhmonov, and the leader of the United Tajik-Opposition, S.A.Huri, on the Results of the Meeting held in Moscow on 23 December 1996",Europe and Eurasia,Tajikistan,116,Tajikistan peace process,Pre,1996-12-23,Intra,Government,Multiparty signed/agreed
59,242,Agreement by the Government of the Philippines (GRP) and the Moro Islamic Liberation Front (MILF),Asia and Pacific,Philippines/Mindanao,90,Philippines - Mindanao process,Pre,1997-09-03,Intra,Government/territory,Multiparty signed/agreed
60,243,"Agreement Concerning the Sovereignty, Independence, Territorial Integrity and Inviolability, Neutrality and National Unity of Cambodia (Framework for a Comprehensive Political Settlement of the Cambodia Conflict or Paris Accords)",Asia and Pacific,Cambodia,17,Cambodian peace process,SubPar,1991-10-23,InterIntra,Government,Multiparty signed/agreed
61,244,Agreement for General Cessation of Hostilities,Asia and Pacific,Philippines/Mindanao,90,Philippines - Mindanao process,Cea,1997-07-18,Intra,Government/territory,Multiparty signed/agreed
62,247,Agreement on a Ceasefire and Separation of Forces,Europe and Eurasia,Georgia/Abkhazia,43,Abkhazia peace process,Cea,1994-05-14,Intra,Government/territory,Multiparty signed/agreed
63,248,Agreement on a ceasefire between the Government of the Democratic Socialist Republic of Sri Lanka and the Liberation Tigers of Tamil Eelam,Asia and Pacific,Sri Lanka,114,Sri Lanka LTTE 2002 onward process,Cea,2002-02-22,Intra,Government/territory,Multiparty signed/agreed
64,249,Agreement on a Ceasefire in Abkhazia and Arrangements to Monitor its Observance  (Sochi Agreement),Europe and Eurasia,Georgia/Abkhazia,43,Abkhazia peace process,Cea,1993-07-27,Intra,Territory,Multiparty signed/agreed
65,250,Agreement on a Ceasefire in the Republic of Yemen,Middle East and North Africa,Yemen,122,Yemen unification process,Cea,1994-06-30,Intra,Government/territory,Multiparty signed/agreed
66,251,"Agreement on a Ceasefire, the Cessation of Military Activities, and on Measures for a Settlement of the Armed Conflict on the Territory of the Chechen Republic",Europe and Eurasia,Russia/Chechnya,93,Chechnya peace process,Cea,1996-05-27,Intra,Government/territory,Multiparty signed/agreed
67,252,Agreement on a Comprehensive Political Settlement of the Cambodia Conflict (Framework for a Comprehensive Political Settlement of the Cambodia Conflict or Paris Accords),Asia and Pacific,Cambodia,17,Cambodian peace process,SubComp,1991-10-23,InterIntra,Government,Multiparty signed/agreed
68,253,Agreement on a Definitive Ceasefire,Americas,Guatemala,45,Guatemala peace process,Cea,1996-12-04,Intra,Government,Multiparty signed/agreed
69,255,Agreement on a General Agenda,Americas,Guatemala,45,Guatemala peace process,Pre,1991-04-26,Intra,Government,Multiparty signed/agreed
70,256,Agreement on a Partial Ceasefire,Africa (excl MENA),Mozambique,78,Mozambique process in the 90s,Cea,1990-12-01,Intra,Government,Multiparty signed/agreed
71,257,Agreement on a Temporary Ceasefire and the Cessation of Other Hostile Acts on the Tajik-Afghan Border and within the Country for the Duration of the Talks [The Tehran Agreement],Europe and Eurasia,Tajikistan,116,Tajikistan peace process,Cea,1994-09-17,Intra,Government,Multiparty signed/agreed
72,258,Agreement on a Timetable for Negotiations of a Firm and Lasting Peace in Guatemala,Americas,Guatemala,45,Guatemala peace process,Pre,1994-03-29,Intra,Government,Multiparty signed/agreed
73,259,Agreement on Ceasefire and Cessation of Hostilities Between the Government of the Republic of Liberia and Liberians United for Reconciliation and Democracy and the Movement for Democracy in Liberia,Africa (excl MENA),Liberia,69,Liberia peace process,Cea,2003-06-17,Intra,Government,Multiparty signed/agreed
74,260,Agreement on Ceasefire in Sierra Leone,Africa (excl MENA),Sierra Leone,71,Sierra Leone peace process,Cea,1999-05-18,Intra,Government,Multiparty signed/agreed
75,261,Agreement on Cessation of Hostilities between the Government of the Federal Democratic Republic of Ethiopia and the Government of the State of Eritrea,Africa (excl MENA),Eritrea/Ethiopia,37,Eritrea-Ethiopia border dispute peace process,Cea,2000-06-18,Inter,Territory,Multiparty signed/agreed
76,262,Agreement on Cessation of Hostilities between the Government of the Republic of Uganda and the Lord's Resistance Army/Movement (LRA/M),Africa (excl MENA),Uganda,120,Uganda peace process,Cea,2006-08-26,Intra,Government,Multiparty signed/agreed
77,267,Agreement on Implementing the Cease-fire and on Modalities of Disarmament (Supplement to the General Agreement signed in Addis Ababa on 8 January 1993),Africa (excl MENA),Somalia,87,Somalia Peace Process,Cea,1993-01-15,Intra,Government,Multiparty signed/agreed
78,270,Agreement on Permanent Ceasefire and Security Arrangements Implementation Modalities between the Government of Sudan (GOS) and the Sudan People's Liberation Movement/People's Liberation Army (SPLM/SPLA) During the Pre-interim and Interim Periods,Africa (excl MENA),South Sudan/Sudan,109,Sudanese (North-South) peace process,Cea,2004-12-31,Intra,Government/territory,Multiparty signed/agreed
79,275,Agreement on Security Arrangements during the Interim Period,Africa (excl MENA),South Sudan/Sudan,109,Sudanese (North-South) peace process,SubPar,2003-09-25,Intra,Government/territory,Multiparty signed/agreed
80,279,Agreement on the clarification of the Akosombo Agreement,Africa (excl MENA),Liberia,69,Liberia peace process,Cea,1994-12-21,Intra,Government,Multiparty signed/agreed
81,280,Agreement on the Establishment of an Ad Hoc Committee,Africa (excl MENA),Somalia,87,Somalia Peace Process,Pre,1993-01-15,Intra,Government,Multiparty signed/agreed
82,284,"Agreement on the Implementation, Compliance and Verification Timetable for the Peace Agreements",Americas,Guatemala,45,Guatemala peace process,Imp,1996-12-29,Intra,Government,Multiparty signed/agreed
83,288,Agreement on the peaceful regulation of the Situation in the Chechen Republic (on a set of military issues),Europe and Eurasia,Russia/Chechnya,93,Chechnya peace process,Pre,1995-07-30,Intra,Government/territory,Multiparty signed/agreed
84,295,Agreement to End Hostilities on Bougainville,Asia and Pacific,Papua New Guinea/Bougainville,9,Bougainville: peace process,Pre,1990-03-01,Intra,Government/territory,Multiparty signed/agreed
85,297,Agreement to Sustain the Quest for Peace (I),Asia and Pacific,Philippines/Mindanao,90,Philippines - Mindanao process,Imp,1998-02-06,Intra,Government/territory,Multiparty signed/agreed
86,298,Agreement to Sustain the Quest for Peace (II),Asia and Pacific,Philippines/Mindanao,90,Philippines - Mindanao process,Cea,1998-03-11,Intra,Government/territory,Multiparty signed/agreed
87,304,Akosombo Agreement,Africa (excl MENA),Liberia,69,Liberia peace process,Imp,1994-09-12,Intra,Government,Multiparty signed/agreed
88,306,Arusha Peace and Reconciliation Agreement for Burundi,Africa (excl MENA),Burundi,16,Burundi: Arusha and related peace process,SubComp,2000-08-28,Intra,Government,Multiparty signed/agreed
89,307,Athens Meeting of the Georgian and Abkhaz sides on confidence-building measures,Europe and Eurasia,Georgia/Abkhazia,43,Abkhazia peace process,Pre,1998-10-18,Intra,Government/territory,Multiparty signed/agreed
90,310,Bishkek Protocol,Europe and Eurasia,Armenia/Azerbaijan/Nagorno-Karabakh,8,Azerbaijan-Nagorno Karabakh: Process,Cea,1994-05-05,Intra,Territory,Multiparty signed/agreed
91,314,Buin Declaration,Asia and Pacific,Papua New Guinea/Bougainville,9,Bougainville: peace process,Pre,1998-08-22,Intra,Government/territory,Multiparty signed/agreed
92,317,Cairo Declaration on Somalia,Africa (excl MENA),Somalia,87,Somalia Peace Process,SubPar,1997-12-22,Intra,Government,Multiparty signed/agreed
93,318,Cease-fire Agreement of 23 November 1991,Europe and Eurasia,Croatia/Yugoslavia (former),127,Croatia negotiation process,Cea,1991-11-23,Intra,Government/territory,Multiparty signed/agreed
94,319,Ceasefire Agreement (Lusaka Agreement),Africa (excl MENA),Democratic Republic of Congo,28,DRC: Second Congo war process,Cea,1999-07-10,Intra,Government,Multiparty signed/agreed
95,320,Agreement of Ceasefire and Cessation of Hostilities between the Sierra Leone Government and the Revolutionary United Front (RUF) ('Abuja Ceasefire Agreement'),Africa (excl MENA),Sierra Leone,71,Sierra Leone peace process,Cea,2000-11-10,Intra,Government,Multiparty signed/agreed
96,321,Ceasefire Agreement between the Transitional Government of Burundi and the Conseil National pour la Defence de la Democratie-Forces pour la Defense de la Democratie,Africa (excl MENA),Burundi,16,Burundi: Arusha and related peace process,Cea,2002-12-02,Intra,Government,Multiparty signed/agreed
97,322,Ceasefire Agreement for Bosnia and Herzegovina,Europe and Eurasia,Bosnia and Herzegovina/Yugoslavia (former),125,Bosnia peace process,Cea,1995-10-05,Intra,Government/territory,Multiparty signed/agreed
98,323,Ceasefire Agreement in Guinea-Bissau,Africa (excl MENA),Guinea-Bissau,46,Guinea Bissau peace process,Cea,1998-08-26,Intra,Government,Multiparty signed/agreed
99,324,Ceasefire Agreement of 29 March 1994,Europe and Eurasia,Croatia/Yugoslavia (former),127,Croatia negotiation process,Cea,1994-03-29,Intra,Government/territory,Multiparty signed/agreed
100,325,Cessation of Hostilities Framework Agreement between the Government of the Republic of Indonesia and the Free Aceh Movement,Asia and Pacific,Indonesia/Aceh,55,Indonesia-Aceh peace process,Cea,2002-12-09,Intra,Government/territory,Multiparty signed/agreed
101,329,Final communiqué of the joint Economic Community of West African States (ECOWAS)/Community of Portuguese-speaking Countries (CPLP) consultative meeting on the situation in Guinea-Bissau,Africa (excl MENA),Guinea-Bissau,46,Guinea Bissau peace process,Cea,1998-08-25,InterIntra,Government,Unilateral document
102,330,Economic Community of West African States six-month peace plan for Sierra Leone (23 October 1997-22 April 1997) (Conakry Peace Plan),Africa (excl MENA),Sierra Leone,71,Sierra Leone peace process,Imp,1997-10-23,Intra,Government,Multiparty signed/agreed
103,333,Comprehensive Agreement concluded between the Government of Nepal and the Communist Party of Nepal (Maoist),Asia and Pacific,Nepal,81,Nepal peace process,SubComp,2006-11-21,Intra,Government,Multiparty signed/agreed
104,336,Comprehensive Ceasefire Agreement between the Government of the Republic of Burundi and the Palipehutu - FNL,Africa (excl MENA),Burundi,16,Burundi: Arusha and related peace process,Cea,2006-09-07,Intra,Government,Multiparty signed/agreed
105,337,Comprehensive Peace Agreement between the Government of the Republic of the Sudan and the Sudan People's Liberation Army/Sudan People's Liberation Movement (Naivasha Agreement),Africa (excl MENA),South Sudan/Sudan,109,Sudanese (North-South) peace process,SubComp,2005-01-09,Intra,Government/territory,Multiparty signed/agreed
106,338,"Peace Agreement between the Government of Liberia, the Liberians United for Reconciliation and Democracy (LURD), the Movement of Democracy in Liberia (MODEL) and the Political Parties (Accra Agreement)",Africa (excl MENA),Liberia,69,Liberia peace process,SubComp,2003-08-18,Intra,Government,Multiparty signed/agreed
107,346,Cotonou Accord (Geneva Ceasefire Agreement),Africa (excl MENA),Liberia,69,Liberia peace process,SubPar,1993-07-25,Intra,Government,Multiparty signed/agreed
108,348,"D.F. Malan Accord and Joint Statement by the State President, Mr F W De Klerk, and Mr Mandela, Deputy, President of the African National Congress",Africa (excl MENA),South Africa,105,South Africa peace process,Pre,1991-02-12,Intra,Government,Multiparty signed/agreed
109,350,Darfur Peace Agreement,Africa (excl MENA),Sudan/Darfur,21,Darfur-Sudan peace process,SubComp,2006-05-05,Intra,Government/territory,Multiparty signed/agreed
110,352,Declaracion de Itamaraty,Americas,Ecuador/Peru,35,Ecuador-Peru border dispute peace process,Cea,1995-02-17,Inter,Territory,Multiparty signed/agreed
111,353,Declaracion de Montevideo,Americas,Ecuador/Peru,35,Ecuador-Peru border dispute peace process,Cea,1995-02-28,Inter,Territory,Multiparty signed/agreed
112,355,Declaration of Cessation of Hostilities,Asia and Pacific,Sri Lanka,113,Sri Lanka Kumaratunga/Devolution Processes ,Cea,1995-01-05,Intra,Government/territory,Multiparty signed/agreed
113,359,Declaration on Cessation of Hostilities and the Structures and Principles of the Somalia National Reconciliation Process (Eldorat Declaration),Africa (excl MENA),Somalia,87,Somalia Peace Process,SubPar,2002-10-27,Intra,Government/territory,Multiparty signed/agreed
