Index,AgreementId,Name,Region,Country,Peace Process,Peace Process Name,Stage,Signed Date,Agreement/Conflict Level,Conflict Nature,Agreement Status
337,1160,The third sesson of peace talks between the Government of Sri Lanka (GOSL) and the Liberation Tigers of Tamil Eelam (LTTE) (Oslo Communique),Asia and Pacific,Sri Lanka,114,Sri Lanka LTTE 2002 onward process,Pre,2002-12-05,Intra,Government/territory,Multiparty signed/agreed
338,1161,"Accelerated Action on Resettlement and Humanitarian Action, Progress on Human Rights",Asia and Pacific,Sri Lanka,114,Sri Lanka LTTE 2002 onward process,Pre,2003-01-09,Intra,Government/territory,Multiparty signed/agreed
339,1163,Statement  by the Royal Norwegian Government; Sri Lanka Peace Talks,Asia and Pacific,Sri Lanka,114,Sri Lanka LTTE 2002 onward process,Pre,2002-09-18,Intra,Government/territory,Multiparty signed/agreed
340,1165,"Confidence, Security-building and Verification (The London Conference)",Europe and Eurasia,Bosnia and Herzegovina/Yugoslavia (former),125,Bosnia peace process,Cea,1992-08-27,InterIntra,Government/territory,Multiparty signed/agreed
341,1173,The Vance Plan (UN Plan),Europe and Eurasia,Croatia/Yugoslavia (former),127,Croatia negotiation process,Pre,1991-12-01,Intra,Government/territory,Unilateral document
342,1185,Implementation Modalities in Support of the Agreement on Cessation of Hostilities between the Government of the Republic of South Sudan (GRSS) and the Sudan People's Liberation Movement/Army (in opposition) (SPLM/A IO),Africa (excl MENA),South Sudan,107,South Sudan post-secession process,Cea,2014-02-24,Intra,Government,Multiparty signed/agreed
343,1186,Protocol on Agreed Principles on Transitional Arrangements Towards Resolution of the Crises in South Sudan,Africa (excl MENA),South Sudan,107,South Sudan post-secession process,SubComp,2014-08-25,Intra,Government,Multiparty signed/agreed
344,1187,Areas of Agreement on the Establishment of the Transitional Government of National unity (TGoNU) in the Republic of South Sudan,Africa (excl MENA),South Sudan,107,South Sudan post-secession process,Imp,2015-02-01,Intra,Government,Multiparty signed/agreed
345,1196,Report on the Meeting between the Aceh Free Movement (GAM) and the Republic of Indonesia (RI),Asia and Pacific,Indonesia/Aceh,55,Indonesia-Aceh peace process,Cea,2001-02-10,Intra,Government/territory,Multiparty signed/agreed
346,1202,Sarajevo Joint Declaration,Europe and Eurasia,Bosnia and Herzegovina/Yugoslavia (former),125,Bosnia peace process,Imp,1993-11-12,InterIntra,Government/territory,Multiparty signed/agreed
347,1213,Statement of understanding concerning the Comprehensive Cease-fire Agreement and the Agreement on Complete Cessation of Hostilities,Europe and Eurasia,Bosnia and Herzegovina/Yugoslavia (former),125,Bosnia peace process,Cea,1995-01-02,Intra,Government/territory,Unilateral document
348,1228,Proposal by the President of the Presidency of FSRY accepted by the Presidency of Slovenia regarding the Crisis in Slovenia,Europe and Eurasia,Slovenia/Yugoslavia (former),126,Dissolution of Yugoslavia,Cea,1991-07-02,Intra,Government/territory,Multiparty signed/agreed
349,1229,Memorandum of Understanding on the Monitor Mission to Yugoslavia,Europe and Eurasia,Croatia/Slovenia/Yugoslavia (former),126,Dissolution of Yugoslavia,Pre,1991-07-13,InterIntra,Government/territory,Multiparty signed/agreed
350,1247,Implementation plan proposed by the Secretary-General pursuant to Security Council resolution 621 (1988) of September 1988,Middle East and North Africa,Morocco/(Western Sahara),77,Morocco-Western Sahara peace process,Imp,1990-06-18,InterIntra,Government/territory,Unilateral document
351,1250,Northern Ireland: Ground Rules for Substantive All-Party Negotiations,Europe and Eurasia,Ireland/United Kingdom/Northern Ireland,62,Northern Ireland peace process,Pre,1996-03-15,Intra,Government/territory,Multiparty signed/agreed
352,1257,IRA Ceasefire Statement,Europe and Eurasia,Ireland/United Kingdom/Northern Ireland,62,Northern Ireland peace process,Cea,1994-08-31,Intra,Government/territory,Unilateral document
353,1258,Combined Loyalist Military Command Ceasefire Statement,Europe and Eurasia,Ireland/United Kingdom/Northern Ireland,62,Northern Ireland peace process,Cea,1994-10-13,Intra,Government/territory,Unilateral document
354,1278,Agreed Statement on behalf of the Parties,Asia and Pacific,Sri Lanka,114,Sri Lanka LTTE 2002 onward process,Pre,2003-03-21,Intra,Government/territory,Multiparty signed/agreed
355,1280,Human Rights issues relating to the peace process,Asia and Pacific,Sri Lanka,114,Sri Lanka LTTE 2002 onward process,Pre,2003-02-08,Intra,Government/territory,Multiparty signed/agreed
356,1283,Protocol on the results of the negotiations by representatives of the federal and Chechen sides,Europe and Eurasia,Russia/Chechnya,93,Chechnya peace process,Pre,1996-06-04,Intra,Government/territory,Multiparty signed/agreed
357,1287,Statement by the President of the Security Council,Cross-regional,(Bougainville)/(United Nations),9,Bougainville: peace process,Imp,1998-04-22,InterIntra,Government/territory,Unilateral document
358,1290,Modalities for the Implementation of the OAU Framework Agreement on the Settlement of the Dispute between Ethiopia and Eritrea,Africa (excl MENA),Eritrea/Ethiopia,37,Eritrea-Ethiopia border dispute peace process,Imp,1999-07-12,Inter,Territory,Multiparty signed/agreed
359,1304,Joint Declaration of Agreement between the Government of Burundi and the CNDD-FDD (The Pretorial Protocol),Africa (excl MENA),Burundi,16,Burundi: Arusha and related peace process,Cea,2003-01-27,Intra,Government,Multiparty signed/agreed
360,1305,Decision A/DEC.1/8/90 on the Ceasefire and Establishment of an ECOWAS Ceasefire Monitoring Group for Liberia (ECOWAS Peace Plan),Africa (excl MENA),Liberia,69,Liberia peace process,Cea,1990-08-07,InterIntra,Government,Unilateral document
361,1307,Decision A/DEC.3/8/90 on the Establishment of a Special Emergency Fund for ECOWAS Operations in the Republic of Liberia (Ecowas Peace Plan),Africa (excl MENA),Liberia,69,Liberia peace process,Cea,1990-08-07,InterIntra,Government,Unilateral document
362,1309,"Decision A/DEC.1/11/90 relating to the Approval of the Decisions of the Community Standing Mediation Committeee Taken During its First Session from 6 to 7 August, 1990, Banjul (Ecowas Peace Plan)",Africa (excl MENA),Liberia,69,Liberia peace process,Ren,1990-11-28,InterIntra,Government,Unilateral document
363,1310,Decision A/DEC.2/11/90 relating to the Adoption of an Ecowas Peace Plan for Liberia and the Entire West African Sub-region (Ecowas Peace Plan),Africa (excl MENA),Liberia,69,Liberia peace process,SubPar,1990-11-28,InterIntra,Government,Unilateral document
364,1311,Decision A/DEC.3/11/90 relating to the Conclusion of an Agreement on the Status of the ECOWAS Cesaefire Monitoring Group (ECOMOG) between the Community and the Interim Government of the Republic of Liberia (Ecowas Peace Plan),Africa (excl MENA),Liberia,69,Liberia peace process,Pre,1990-11-28,InterIntra,Government,Unilateral document
365,1313,"Communique Issued at the Conclusion of the Peace Talks on Liberia, Geneva",Africa (excl MENA),Liberia,69,Liberia peace process,Pre,1993-07-17,Intra,Government,Multiparty signed/agreed
366,1314,Mechanism for Returning Liberia to the Abuja Agreement,Africa (excl MENA),Liberia,69,Liberia peace process,Imp,1996-05-08,InterIntra,Government,Unilateral document
367,1316,Ceasefire Agreement (Bicesse Accords),Africa (excl MENA),Angola,4,Angola: UNITA process,Cea,1991-05-31,Intra,Government,Multiparty signed/agreed
368,1317,Fundamental principles for the establishment of Peace in Angola (Bicesse Accords),Africa (excl MENA),Angola,4,Angola: UNITA process,Cea,1991-05-31,Intra,Government,Multiparty signed/agreed
369,1318,Concepts for Resolving the Issues Still Pending between the Government of the People's Republic of Angola and UNITA (Bicesse Accords),Africa (excl MENA),Angola,4,Angola: UNITA process,SubPar,1993-05-31,Intra,Government,Multiparty signed/agreed
370,1321,Agreement Between the Chin National Front (CNF) and Union-Level Peace Working Committee at the 2nd Round of Peace Talks,Asia and Pacific,Myanmar,80,Myanmar ceasefires process with ethnic armed groups,SubPar,2012-12-09,Intra,Government/territory,Multiparty signed/agreed
371,1324,"Terms of Reference and Power of the National Monitoring Committee on Code of Conduct for Ceasefire 
",Asia and Pacific,Nepal,81,Nepal peace process,Cea,2006-06-26,Intra,Government,Multiparty signed/agreed
372,1325,Dissolution of NMCC,Asia and Pacific,Nepal,81,Nepal peace process,Cea,2006-11-30,Intra,Government,Multiparty signed/agreed
373,1326,"Procedures of the National Monitoring Committee on Code of Conduct for Ceasefire
",Asia and Pacific,Nepal,81,Nepal peace process,Cea,2006-06-26,Intra,Government,Multiparty signed/agreed
374,1332,Statement of the Five Permanent Members of the Security Council of the United Nations on Cambodia Incorporating the Framework for a Comprehensive Political Settlement of the Cambodia Conflict,Asia and Pacific,Cambodia,17,Cambodian peace process,Pre,1990-08-28,InterIntra,Government,Unilateral document
375,1336,Memorandum of Peace and Understanding in Cabinda Province,Africa (excl MENA),Angola/Cabinda ,137,Cabinda process,SubComp,2006-08-01,Intra,Government/territory,Multiparty signed/agreed
376,1341,"Acuerdo Gobierno nacional-CRS, Flor del Monte",Americas,Colombia,97,Colombia I - Gaviria,Pre,1993-12-18,Intra,Government,Multiparty signed/agreed
377,1355,Protocol on the Implementation of the Terms of Reference (TOR) of the Independent Decommissioning Body (IDB),Asia and Pacific,Philippines/Mindanao,90,Philippines - Mindanao process,Imp,2015-01-29,Intra,Government/territory,Multiparty signed/agreed
378,1357,Agreement on the Resolution of the Conflict in the Republic of South Sudan (ARCSS),Africa (excl MENA),South Sudan,107,South Sudan post-secession process,SubComp,2015-08-17,Intra,Government,Multiparty signed/agreed
379,1362,Memorandum of 19 September 2014 (Memorandum on Implementation),Europe and Eurasia,Ukraine,121,Ukraine peace process,Cea,2014-09-19,Intra,Government/territory,Multiparty signed/agreed
380,1364,Package of Measures for the Implementation of the Minsk Agreements (Minsk II),Europe and Eurasia,Ukraine,121,Ukraine peace process,Imp,2015-02-12,Intra,Government/territory,Multiparty signed/agreed
381,1365,Accord Pour la Paix et la Reconciliation au Mali - Issu du Processus d'Alger,Africa (excl MENA),Mali/Azawad,74,Mali-Azawad Inter-Azawad peace process,SubComp,2015-06-20,Intra,Government,Multiparty signed/agreed
382,1367,Arrangement sécuritaire pour une cessation des hostilités,Africa (excl MENA),Mali/Azawad,74,Mali-Azawad Inter-Azawad peace process,Cea,2015-06-05,Intra,Government/territory,Multiparty signed/agreed
383,1370,Libyan Political Agreement (Sukhairat Agreement),Middle East and North Africa,Libya,70,Libyan peace process,SubComp,2015-12-17,Intra,Government,Multiparty signed/agreed
384,1392,"Joint Communiqué, Havana, August 5, 2014",Americas,Colombia,101,Colombia V - Santos,SubPar,2014-08-05,Intra,Government,Multiparty signed/agreed
385,1397,"Joint Communiqué #55, Havana ",Americas,Colombia,101,Colombia V - Santos,Pre,2015-07-12,Intra,Government,Multiparty signed/agreed
386,1419,Loi du 21 novembre 2003 portant amendement à la Constitution  de Transition du 28 octobre 2001,Africa (excl MENA),Burundi,16,Burundi: Arusha and related peace process,SubComp,2003-11-21,Intra,Government,Multiparty signed/agreed
387,1426,Feuille de route des negotiations dans le cadre du processus d’Alger,Africa (excl MENA),Mali/Azawad,74,Mali-Azawad Inter-Azawad peace process,Pre,2014-07-24,Intra,Government,Multiparty signed/agreed
388,1428,Teksti integral i Marrëveshjes së nënshkruar nё Konçul,Europe and Eurasia,Serbia/Yugoslavia (former)/Presevo Valley,130,Presevo Valley process,Cea,2001-03-12,Intra,Government/territory,Unilateral document
389,1430,Demilitarization Statement (Konculj Agreement),Europe and Eurasia,Serbia/Yugoslavia (former)/Presevo Valley,130,Presevo Valley process,Cea,2001-05-20,Intra,Government/territory,Unilateral document
390,1433,Doha Agreement,Middle East and North Africa,Yemen,123,Yemen peace process,Cea,2008-02-01,Intra,Government,Multiparty signed/agreed
391,1434,Six-Point Government of Yemen-Houthi Ceasefire Agreement,Middle East and North Africa,Yemen,123,Yemen peace process,Cea,2010-02-12,Intra,Government,Multiparty signed/agreed
392,1436,The Nationwide Ceasefire Agreement (NCA) between The Government of the Republic of the Union of Myanmar and the Ethnic Armed Organizations (EAO),Asia and Pacific,Myanmar,80,Myanmar ceasefires process with ethnic armed groups,Cea,2015-10-15,Intra,Government/territory,Multiparty signed/agreed
393,1439,Basque Ceasefire Statement,Europe and Eurasia,Spain/Basque Country,112,Spain - Basque internal process,Cea,2011-10-01,Intra,Government/territory,Unilateral document
394,1440,"'Hudna’ (truce) of al-Zabadani, Kefriyya and al-Fu’aa",Middle East and North Africa,Syria,133,Intra-Syrian Process (state/non-state),Cea,2015-09-20,IntraLocal,Government,Multiparty signed/agreed
395,1441,Homs Ceasefire,Middle East and North Africa,Syria,133,Intra-Syrian Process (state/non-state),Cea,2015-12-07,IntraLocal,Government,Multiparty signed/agreed
396,1448,Cease-fire Agreement,Europe and Eurasia,Croatia/Yugoslavia (former),127,Croatia negotiation process,Cea,1991-09-01,Intra,Government/territory,Multiparty signed/agreed
397,1449,Joint Statement (Igalo Ceasefire Agreement) ,Europe and Eurasia,Croatia/Yugoslavia (former),127,Croatia negotiation process,Cea,1991-09-17,Intra,Government/territory,Multiparty signed/agreed
398,1450,JNA - Croatia Cease-fire Agreement of September 22,Europe and Eurasia,Croatia/Yugoslavia (former),127,Croatia negotiation process,Cea,1991-09-22,Intra,Government/territory,Multiparty signed/agreed
399,1451,Agreement between the JNA and the Representatives of Ilok,Europe and Eurasia,Croatia/Yugoslavia (former),127,Croatia negotiation process,Cea,1991-10-14,IntraLocal,Government/territory,Multiparty signed/agreed
400,1452,Ceasefire Agreement (The Hague) ,Europe and Eurasia,Croatia/Yugoslavia (former),127,Croatia negotiation process,Cea,1991-10-18,Intra,Government/territory,Multiparty signed/agreed
401,1453,Agreement between the official delegates of the Republic of Croatia and the JNA,Europe and Eurasia,Croatia/Yugoslavia (former),127,Croatia negotiation process,Cea,1991-11-22,Intra,Government/territory,Multiparty signed/agreed
402,1455,Agreement (Dubrovnik ceasefire),Europe and Eurasia,Croatia/Yugoslavia (former),127,Croatia negotiation process,Cea,1991-12-07,Intra,Government/territory,Multiparty signed/agreed
403,1456,Joint Statement (Zagreb),Europe and Eurasia,Croatia/Yugoslavia (former),127,Croatia negotiation process,Cea,1991-12-08,Intra,Government/territory,Multiparty signed/agreed
404,1457,Concept for a United Nations peace-keeping operation in Yugoslavia,Europe and Eurasia,Croatia/Yugoslavia (former),127,Croatia negotiation process,Pre,1991-12-11,InterIntra,Government/territory,Unilateral document
405,1461,Agreement in Implementation of Security Council Resolution 802 (1993),Europe and Eurasia,Croatia/Yugoslavia (former),127,Croatia negotiation process,Cea,1993-04-06,Intra,Government/territory,Multiparty signed/agreed
406,1462,Agreement (Erdut/Zagreb),Europe and Eurasia,Croatia/Yugoslavia (former),127,Croatia negotiation process,Cea,1993-07-15,Intra,Government/territory,Multiparty signed/agreed
407,1463,Complementary agreement to the agreement of 15-16 July 1993 ,Europe and Eurasia,Croatia/Yugoslavia (former),127,Croatia negotiation process,Cea,1993-07-23,InterIntra,Government/territory,Multiparty signed/agreed
408,1464,Agreement on UNPROFOR Control of 'Medak Pocket',Europe and Eurasia,Croatia/Yugoslavia (former),127,Croatia negotiation process,Cea,1993-09-15,Intra,Government/territory,Status unclear
409,1468,Agreement on the Surrender of the 21st Corps ,Europe and Eurasia,Croatia/Yugoslavia (former),127,Croatia negotiation process,Cea,1995-08-08,Intra,Government/territory,Multiparty signed/agreed
410,1470,Bosnia-Herzegovina Ceasefire Agreement,Europe and Eurasia,Bosnia and Herzegovina/Yugoslavia (former),125,Bosnia peace process,Cea,1992-04-12,Intra,Government/territory,Multiparty signed/agreed
411,1472,The Public Announcement (Graz Agreement),Europe and Eurasia,Bosnia and Herzegovina/Yugoslavia (former),128,Bosnia Local peace processes,SubPar,1992-05-06,Intra,Government/territory,Multiparty signed/agreed
412,1473,"Agreement on removal of Commands, Units and Institutions from Garrisons-Barracks of Zenica, Travnik, Konjic and Barracks and Institutions in Sarajevo ",Europe and Eurasia,Bosnia and Herzegovina/Yugoslavia (former),125,Bosnia peace process,Cea,1992-05-10,Intra,Government/territory,Multiparty signed/agreed
413,1474,Sporazum o prekidu vatre u Bosni i Hercegovini,Europe and Eurasia,Bosnia and Herzegovina/Yugoslavia (former),125,Bosnia peace process,Cea,1992-05-18,Intra,Government/territory,Multiparty signed/agreed
414,1477,"Text of the agreement signed at London on 17 July 1992 by Mr. Boban, Dr. Karadzic and Dr. Silajdzic",Europe and Eurasia,Bosnia and Herzegovina/Yugoslavia (former),125,Bosnia peace process,Cea,1992-07-17,Intra,Government/territory,Multiparty signed/agreed
415,1482,Joint Statement; enclosure of Command Structure for the BiH Army and the HVO,Europe and Eurasia,Bosnia and Herzegovina/Yugoslavia (former),125,Bosnia peace process,Imp,1993-04-25,InterIntra,Government/territory,Multiparty signed/agreed
416,1483,Agreement on the Demilitarization of Srebrenica and Zepa concluded between Lt Gen Ratko Mladic and Gen Sefer Halilovic on 8 May 1993 in the presence of Lt Gen Philippe Morillon,Europe and Eurasia,Bosnia and Herzegovina/Yugoslavia (former),125,Bosnia peace process,Cea,1993-05-08,Intra,Government/territory,Multiparty signed/agreed
417,1484,"Agreement on the cessation of hostilities in Bosnia and Herzegovina concluded between Gen. Milivoj Petkovic and Gen. Sefer Halilovic on 12 May 1993, in the presene of Lt. Gen. Philippe Morillon and ECMM.HRC Jean-Pierre Thebault",Europe and Eurasia,Bosnia and Herzegovina/Yugoslavia (former),125,Bosnia peace process,Cea,1993-05-12,Intra,Government/territory,Multiparty signed/agreed
418,1490,Agreement for withdrawal of forces from Igman and Bjelasnica,Europe and Eurasia,Bosnia and Herzegovina/Yugoslavia (former),125,Bosnia peace process,Cea,1993-08-14,Intra,Government/territory,Multiparty signed/agreed
419,1497,Peace Accord (Ceasefire at Camp Pleso),Europe and Eurasia,Bosnia and Herzegovina/Yugoslavia (former),125,Bosnia peace process,Cea,1994-02-23,Intra,Government/territory,Multiparty signed/agreed
420,1499,"Final agreement reached between SRSG, Mr Akashi and the Bosnian Serb civilian and military authorities, Belgrade, 23 April 1994",Europe and Eurasia,Bosnia and Herzegovina/Yugoslavia (former),125,Bosnia peace process,Cea,1994-04-23,Intra,Government/territory,Unilateral document
421,1500,COREU from ICFY,Europe and Eurasia,Bosnia and Herzegovina/Yugoslavia (former),125,Bosnia peace process,Cea,1994-06-08,InterIntra,Government/territory,Multiparty signed/agreed
422,1501,Agreement on the Elimination of Sniping Activities in the Sarajevo Region ,Europe and Eurasia,Bosnia and Herzegovina/Yugoslavia (former),125,Bosnia peace process,Cea,1994-08-14,Intra,Government/territory,Multiparty signed/agreed
423,1504,Comprehensive Peace Agreement (Carter Agreement),Europe and Eurasia,Bosnia and Herzegovina/Yugoslavia (former),125,Bosnia peace process,Pre,1994-12-21,Intra,Government/territory,Multiparty signed/agreed
424,1507,"Terms for Cessation of Hostilities in Syria, incorporated in Joint Statement of the United States and the Russian Federation, as Co-Chairs of the ISSG, on Cessation of Hostilities in Syria",Middle East and North Africa,Syria,115,Syrian peace process,Cea,2016-02-22,InterIntra,Government,Multiparty signed/agreed
425,1511,Gali Protocol of 8th October 2003 on reducing the tension and improving the mechanisms for security in the conflict zone,Europe and Eurasia,Georgia/Abkhazia,43,Abkhazia peace process,Cea,2003-10-08,Intra,Government/territory,Multiparty signed/agreed
426,1512,Minutes of the Disengagement Agreement and Truce between the areas of Warshafānah and al-Zāwiyyah ,Middle East and North Africa,Libya,72,Libyan local processes,Cea,2015-11-12,IntraLocal,Government,Multiparty signed/agreed
427,1519,The Framework for Political Dialogue,Asia and Pacific,Myanmar,80,Myanmar ceasefires process with ethnic armed groups,Pre,2015-10-15,Intra,Government/territory,Multiparty signed/agreed
428,1521,Accord de N'Djaména entre le Gouvernement de la République du Niger et le Front Démocratique pour le Renouveau (FDR),Africa (excl MENA),Niger/Air and Azawad,83,Niger peace process,SubPar,1998-08-21,Intra,Government/territory,Multiparty signed/agreed
429,1525,Homs Hudna Agreement,Middle East and North Africa,Syria,133,Intra-Syrian Process (state/non-state),Cea,2014-02-07,IntraLocal,Government,Multiparty signed/agreed
430,1527,Damascus Truce I between Bayt Sahem and Babila,Middle East and North Africa,Syria,133,Intra-Syrian Process (state/non-state),Cea,2014-02-17,IntraLocal,Government,Multiparty signed/agreed
431,1541,Fatah-Hamas Agreement,Middle East and North Africa,Palestine,33,"Palestine, Intra-Palestian agreements",Imp,2014-09-25,Intra,Inter-group,Multiparty signed/agreed
432,1544,Military Code of Conduct between the Government of Burma and Ethnic Armed Organisations (EAO) in Accordance with the National Ceasefire Agreement (NCA),Asia and Pacific,Myanmar,80,Myanmar ceasefires process with ethnic armed groups,Cea,2015-11-18,Intra,Government/territory,Multiparty signed/agreed
433,1545,Joint Monitoring Committee guideline for Each Level (Draft),Asia and Pacific,Myanmar,80,Myanmar ceasefires process with ethnic armed groups,Cea,2015-10-15,Intra,Government/territory,Multiparty signed/agreed
434,1546,12-Point Agreement of Union Peace-making work committee and the All Burma Students' Democratic Front (ABSDF) Union-level Peace Talks,Asia and Pacific,Myanmar,80,Myanmar ceasefires process with ethnic armed groups,Pre,2013-08-10,Intra,Government/territory,Multiparty signed/agreed
435,1550,8-Point Agreement between the Union Peacemaking Working Committee (UPWC) and Karenni National Progressive Party (KNPP),Asia and Pacific,Myanmar,80,Myanmar ceasefires process with ethnic armed groups,Cea,2013-06-20,Intra,Government/territory,Multiparty signed/agreed
436,1551,"Chin National Front (CNF), Government Ceasefire Agreement",Asia and Pacific,Myanmar,80,Myanmar ceasefires process with ethnic armed groups,Cea,2012-05-07,Intra,Government/territory,Multiparty signed/agreed
437,1552,"Kalo Htoo Baw (DKBA-5), Government State-level Peace Agreement",Asia and Pacific,Myanmar,80,Myanmar ceasefires process with ethnic armed groups,Cea,2011-11-03,Intra,Government/territory,Multiparty signed/agreed
438,1553,Statement on Initial Agreement between the Karen National Union (KNU) and Burmese Government,Asia and Pacific,Myanmar,80,Myanmar ceasefires process with ethnic armed groups,Cea,2012-01-13,Intra,Government/territory,Multiparty signed/agreed
439,1557,"New Mon State Party (NMSP), Government 4-Point Union-Level Peace Agreement",Asia and Pacific,Myanmar,80,Myanmar ceasefires process with ethnic armed groups,Cea,2012-02-25,Intra,Government/territory,Multiparty signed/agreed
440,1558,"Nationalist Socialist Council of Nagaland-Khaplang (NSCN-K), Government State-Level Peace Agreement",Asia and Pacific,Myanmar,80,Myanmar ceasefires process with ethnic armed groups,Cea,2012-04-09,Intra,Government/territory,Multiparty signed/agreed
441,1559,"Shan State Army-South (SSA-S), Government Ceasefire Agreement",Asia and Pacific,Myanmar,80,Myanmar ceasefires process with ethnic armed groups,Cea,2011-12-02,Intra,Government/territory,Multiparty signed/agreed
442,1560,"Shan State Army-South (SSA-S), Government 11-Point Peace Agreement",Asia and Pacific,Myanmar,80,Myanmar ceasefires process with ethnic armed groups,Cea,2012-01-16,Intra,Government/territory,Multiparty signed/agreed
443,1561,"Shan State Army-South (SSA-S), Government 12-Point Peace Agreement",Asia and Pacific,Myanmar,80,Myanmar ceasefires process with ethnic armed groups,Cea,2012-05-19,Intra,Government/territory,Multiparty signed/agreed
444,1562,"Shan State Progress Party (SSPP)/Shan State Army-North (SSAN), Government Preliminary Peace and 5-Point Peace Agreement",Asia and Pacific,Myanmar,80,Myanmar ceasefires process with ethnic armed groups,Cea,2012-01-28,Intra,Government/territory,Multiparty signed/agreed
445,1563,"United Wa State Army (UWSA), Government 6-Point Union-Level Peace Agreement",Asia and Pacific,Myanmar,80,Myanmar ceasefires process with ethnic armed groups,Cea,2012-12-26,Intra,Government/territory,Multiparty signed/agreed
446,1564,KLUU Press Release on 1st Meeting Between (Karen National Union) KNU Delegation and Union-Level Peace Delegation,Asia and Pacific,Myanmar,80,Myanmar ceasefires process with ethnic armed groups,Cea,2012-04-07,Intra,Government/territory,Multiparty signed/agreed
447,1565,"Final Communique, Economic Community of West African States, First Extraordinary Session of the Authority of Heads of State and Government, Bamako, 27 and 28 November 1990",Africa (excl MENA),Liberia,69,Liberia peace process,Imp,1990-11-28,InterIntra,Government,Unilateral document
448,1569,Joint Statement,Europe and Eurasia,Bosnia and Herzegovina/Yugoslavia (former),128,Bosnia Local peace processes,Cea,1993-10-21,Intra,Government/territory,Multiparty signed/agreed
449,1573,Algiers Declaration,Africa (excl MENA),Mali/Azawad,74,Mali-Azawad Inter-Azawad peace process,Pre,2014-06-09,Intra,Inter-group,Multiparty signed/agreed
